Unnamed: 0,Unnamed: 0.1,id1,Description1,id2,Description2,Type of dependency,label,AnnotationStatus
706.0,4209.0,2523.0,beginn whats proper procedure check,3591.0,beginrn duckinator branch fo,independent,0.0,
738.0,1632.0,4265.0,beginrn many library relaunch ruby pe,8632.0,remove following warning refinem,independent,0.0,
320.0,251.0,14392.0,would like see implemented ruby pipe,15799.0,implemented pipeline operator topi,relates,1.0,
1284.0,6632.0,6868.0,beginrni propose make use,9585.0,please add method object,independent,0.0,
1033.0,491.0,12026.0,add simple way filter warning,11588.0,ruby current warning system lacking warn,relates,1.0,
421.0,3220.0,12586.0,hellornrnclass array sample method,7055.0,beginrni propose make use self,independent,0.0,
1448.0,4120.0,9834.0,id like add floatnext float floatpre,10077.0,merge matrix horizontally verticallyr,independent,0.0,
707.0,6848.0,14924.0,hellornrnin job many mat,13562.0,yield self enumerator instance always,independent,0.0,
1127.0,4683.0,12519.0,hi allrnrni propose syntax change al,3427.0,beginrn dir friend seem absen,independent,0.0,
162.0,70.0,14736.0,ruby concurrency greatly enhanced co,16786.0,abstractrnrnwe propose introduce li,relates,1.0,
566.0,3902.0,10098.0,could totally wrong seems sta,13827.0,improve performance,independent,0.0,
244.0,182.0,5663.0,pretty common want map en,15323.0,proposal combined filter,relates,1.0,
160.0,941.0,4780.0,mentioned another rejected issue,4615.0,beginnfileeach linesep line c,relates,1.0,
1211.0,6820.0,7258.0,eric hodel planning update rdoc e,7918.0,currently ruby library way detect,independent,0.0,
312.0,973.0,8765.0,beginrni propose symbol literal,13838.0,descriptionrnrni want detect current,independent,0.0,
855.0,323.0,13213.0,issue tracking gem release scan,5481.0,beginrnrnuptodate summary propo,relates,1.0,
1259.0,5631.0,15588.0,stringeach chunk iterates chunk specified,11377.0,poll ppoll superior api,independent,0.0,
104.0,588.0,10085.0,case conversion function currently limite,10002.0,hi ruby version problem,relates,1.0,
359.0,5438.0,6712.0,activesupport add support alias method ch,1206.0,beginrn created new unit test runn,independent,0.0,
45.0,7130.0,16555.0,id like add nethttpverify hostname,8229.0,id like suggest extend hashinclude,independent,0.0,
255.0,699.0,8658.0,adding new method processclock g,8096.0,beginrna lot scenario application,relates,1.0,
1203.0,703.0,8015.0,diff git agcc bgccrnindex,2837.0,beginrn gc currently increase size,relates,1.0,
444.0,566.0,10329.0,followupto feature optimize recv,10326.0,concatenating literal string existing stri,relates,1.0,
266.0,2961.0,11796.0,fix reduce call get stat much po,7274.0,beginrnas corollary unboundmethods,independent,0.0,
793.0,321.0,13241.0,currently exploratory proposalr,14618.0,abstractrnrnunicode display width,relates,1.0,
555.0,3017.0,5877.0,currently taking substring str,13721.0,since attr hash key frequently reused,independent,0.0,
1489.0,280.0,13985.0,since truefalsenilintegerfloat jus,13983.0,since basically value typesrnthey,relates,1.0,
1250.0,737.0,7378.0,variant filewrite pa,7362.0,pathname start another pathname th,relates,1.0,
323.0,582.0,10085.0,case conversion function currently limite,2034.0,beginrn consideration recently giv,relates,1.0,
964.0,158.0,15752.0,believe introduce module exp,15903.0,rubyvm contains mostly mrispecific feature b,relates,1.0,
1457.0,923.0,7241.0,often use inject method build,5008.0,beginrnhellornrni using ruby,relates,1.0,
1182.0,5617.0,13208.0,found need recently class,4347.0,beginrn patch test continuation tra,independent,0.0,
894.0,992.0,3649.0,beginn arraysample arrayshuffle arraysh,3647.0,arraysample support sampling,relates,1.0,
490.0,122.0,16150.0,much time user call,16153.0,freezing string give u nice performanc,relates,1.0,
1011.0,273.0,14035.0,reproducernrnexecute urifileetc,15861.0,recently ruby getting better parsing ur,relates,1.0,
1101.0,7609.0,4742.0,currently option fileopen,12655.0,took task make looksee gem wor,independent,0.0,
1223.0,1468.0,14151.0,dont even understand method hasnt,10195.0,im developing haskell binding ruby c,independent,0.0,
921.0,918.0,4512.0,beginrnits use,5041.0,id like set fd cloexec file descri,relates,1.0,
1145.0,561.0,10425.0,method near like following would u,15811.0,backgroundrnrnequal comparison method,relates,1.0,
576.0,3105.0,6707.0,dont need check anymorernrnhtt,11690.0,given assign multiple variable,independent,0.0,
1126.0,519.0,13789.0,new direntries dirchidren wo,11302.0,direntries return array content wi,relates,1.0,
1076.0,1887.0,10227.0,benchmarked found include,7704.0,multiple ruby implementation experi,independent,0.0,
112.0,1018.0,3112.0,beginrn whyrnendrn,2340.0,beginn yaml syck why product,relates,1.0,
62.0,1.0,6521.0,ive added patch cover kernel module docu,13801.0,keeping class semantics set sho,independent,0.0,
1105.0,4496.0,10189.0,ported simplecov,16605.0,couldnt find anything bug,independent,0.0,
349.0,428.0,12240.0,often improvement implicit block argume,15741.0,numbered parameter introduced,relates,1.0,
424.0,4829.0,4589.0,beginrnplease add threadsafe meth,5767.0,patch add caching expanded load path,independent,0.0,
1200.0,7752.0,12317.0,want method return name space,17265.0,summary rb would benefit e,independent,0.0,
369.0,7292.0,5462.0,currently httpproxyserver proxy,12596.0,introduced dirempty,independent,0.0,
413.0,812.0,6482.0,beginrnthis patch add full uri request,5064.0,currently problem netht,relates,1.0,
762.0,647.0,12697.0,method like alias method attr accessor defi,8846.0,propose changing moduleinclude public,relates,1.0,
623.0,1742.0,9515.0,io class pair class meth,12752.0,parsed binary protocol msgpack,independent,0.0,
285.0,6199.0,14815.0,benchmarkdriverrb add cpu time measurement,6720.0,found discrepancy datetimestrf,independent,0.0,
155.0,7158.0,12380.0,issue somewhat flavor,13118.0,useful array return repeated p,independent,0.0,
507.0,550.0,10728.0,add warning fixnumsize rn,7517.0,maximum minimum number fixnum,relates,1.0,
257.0,466.0,12019.0,nowadays almost every processor,12021.0,final instance variable ruby,relates,1.0,
219.0,757.0,7241.0,often use inject method build,4151.0,beginrn hirn rn method,relates,1.0,
1110.0,639.0,8579.0,id like propose new type string liter,8923.0,related feature already f,relates,1.0,
1218.0,894.0,9528.0,want add factorial method mathnrb file,11517.0,im submitting patch enhance queuepop,independent,0.0,
1035.0,4675.0,14896.0,several stdlib library support reading fr,14717.0,case may beneficial disable,independent,0.0,
1000.0,765.0,6946.0,beginrnhi running test suite fips e,6943.0,chance make pstore compatible,relates,1.0,
557.0,278.0,13985.0,since truefalsenilintegerfloat jus,13983.0,since basically value typesrnthey,relates,1.0,
235.0,2507.0,8377.0,beginrn usually constant looku,17276.0,although obviously syntax error,independent,0.0,
694.0,2966.0,13333.0,currently block take block bl,12744.0,patch add strreverse strre,independent,0.0,
486.0,4636.0,6583.0,beginrnif user try bind port tha,5622.0,adding documentation bigdecimalinfinity,independent,0.0,
514.0,6174.0,8887.0,adding optional argument,10771.0,constant difficult get sour,independent,0.0,
216.0,646.0,8846.0,propose changing moduleinclude public,6539.0,feel inconsistency meth,relates,1.0,
883.0,6634.0,15901.0,case want create p,15580.0,hellornrni sure whether propo,independent,0.0,
1191.0,587.0,6739.0,hi therernrnwhen wrapping single lin,10042.0,postfix rescue notation convenientbu,relates,1.0,
1502.0,2963.0,16027.0,abstractrnrni propose ruby dtrac,13714.0,know possible run minimalisti,independent,0.0,
1300.0,6030.0,14140.0,already branching error logging format f,4521.0,beginrnwhen nonexisting method called,independent,0.0,
1071.0,538.0,11083.0,nettelnet maintainer issue,5481.0,beginrnrnuptodate summary propo,relates,1.0,
896.0,1219.0,12016.0,symbol literal invalid source,12831.0,im trying replace rails grapheme impleme,independent,0.0,
228.0,461.0,12334.0,sort relates,12021.0,final instance variable ruby,relates,1.0,
1100.0,295.0,13685.0,unicode published week ago,12513.0,unicode published yesterday see,relates,1.0,
948.0,4043.0,9614.0,hi matz would like permission remov,11814.0,set encoding string v,independent,0.0,
350.0,125.0,16122.0,value object useful concept introduc,16769.0,backgroundrnweve discussed interface,relates,1.0,
1273.0,464.0,12019.0,nowadays almost every processor,11539.0,summaryrnrnwe seek add mechanism fo,relates,1.0,
473.0,6104.0,16739.0,often see code like followingrnrn,6744.0,example download filern,independent,0.0,
1458.0,3598.0,15233.0,ive looking sympys slow matrix power,8111.0,howwho contact redmine management,independent,0.0,
540.0,82.0,16476.0,seems like blocking syscall done,17134.0,add resolve timeout tcpsocketnewrnit,relates,1.0,
1084.0,540.0,5481.0,beginrnrnuptodate summary propo,11057.0,gemified json libraryrnrn,relates,1.0,
866.0,681.0,8499.0,according experience following two,15863.0,add hashslicernrnin,relates,1.0,
885.0,3617.0,12161.0,bigdecimals inspect humanfriend,13083.0,consistencyrnrn patch,independent,0.0,
498.0,1870.0,8842.0,beginrni propose extend integer accep,16435.0,idea obvious couldnt find di,independent,0.0,
265.0,6926.0,4111.0,beginn chance adding support,3653.0,beginrn expression ab applie,independent,0.0,
185.0,107.0,16253.0,using thisrnrnrubyrn def,16296.0,settled syntax rem,relates,1.0,
284.0,4595.0,7258.0,eric hodel planning update rdoc e,8691.0,following codernrndef reassigned unuse,independent,0.0,
1507.0,5635.0,16021.0,rounding method currently accept numb,9678.0,whatever worth ive,independent,0.0,
560.0,60.0,16987.0,enumeration designed greedy immedi,17312.0,offspring vague,relates,1.0,
1082.0,5591.0,11781.0,hellornrnfor string dornrn,10869.0,know topic tricky please bear wi,independent,0.0,
356.0,426.0,12241.0,refinement feature,5054.0,though matz said ruby,relates,1.0,
1170.0,2800.0,9116.0,there nothing corresponding python rspl,12096.0,order create symbol include nonwo,independent,0.0,
1249.0,7328.0,1303.0,beginn following script defines method,16375.0,reference pr,independent,0.0,
508.0,89.0,16441.0,method like take al,16446.0,led think issue ge,relates,1.0,
88.0,4034.0,12655.0,took task make looksee gem wor,12083.0,think bindinglocal variable get bind,independent,0.0,
1045.0,277.0,13985.0,since truefalsenilintegerfloat jus,12979.0,proposal resulting discussion,relates,1.0,
787.0,590.0,12512.0,think value transformation fundamental,9970.0,method simplify two common pattern whe,relates,1.0,
1335.0,296.0,13685.0,unicode published week ago,14802.0,unicode version published somet,relates,1.0,
1221.0,102.0,16355.0,currently single line pattern matchingexpr,16370.0,wrote codernrn rubyrnn,relates,1.0,
1228.0,169.0,15657.0,maintenance webrick hard rub,17303.0,propose move webrick bundled gem r,relates,1.0,
373.0,2300.0,16602.0,would make sense eval frozen stri,4688.0,documented functionslast functionscount,independent,0.0,
392.0,318.0,13201.0,issue tracking gem release dbm,13248.0,issue tracking gem release gdbm,relates,1.0,
1285.0,558.0,10552.0,counting many time value appears som,7793.0,would nice following method,relates,1.0,
1231.0,1167.0,5658.0,beginrncurrently method mkmf,11318.0,delay hash lookup hit,independent,0.0,
414.0,622.0,9108.0,hirnrni seem regularly requir,8499.0,according experience following two,relates,1.0,
588.0,7625.0,4233.0,beginrn intentional used vi,6521.0,ive added patch cover kernel module docu,independent,0.0,
876.0,235.0,11105.0,support hash literal,14579.0,allow value omission hash lite,relates,1.0,
693.0,695.0,6671.0,beginrnis method already,14951.0,propose adding new operator truthyfal,independent,0.0,
58.0,6523.0,7418.0,id like propose method return,17326.0,abstractrnrnwe add method kern,independent,0.0,
837.0,157.0,15743.0,understanding rubyvm supposed,15752.0,believe introduce module exp,relates,1.0,
785.0,490.0,11670.0,warn without compile timernrnsee,11665.0,wisdom using local variable,relates,1.0,
1357.0,915.0,5054.0,though matz said ruby,16746.0,ruby syntax full end im paranoid,relates,1.0,
1075.0,232.0,14609.0,abstractrnrnkernelpobj print obj,15112.0,sometimes write stderrputs objinspect,relates,1.0,
86.0,223.0,13618.0,rnauto fiber schedule rb wait sin,14736.0,ruby concurrency greatly enhanced co,relates,1.0,
797.0,608.0,11049.0,sometime want grep like operation,9602.0,enumerablegrep useful filter thing,relates,1.0,
938.0,2344.0,15010.0,currently multiple array allocated,4452.0,beginnthis pretty much duplicate,independent,0.0,
291.0,401.0,12512.0,think value transformation fundamental,6669.0,given hash hmap return arrayali,relates,1.0,
614.0,2383.0,6530.0,ive added patch improve documentation fo,8586.0,hirnrnfrequently need run simple f,independent,0.0,
882.0,6379.0,10064.0,put proc object clause,14684.0,summaryrnrnirb swallow exception,independent,0.0,
360.0,6675.0,16833.0,surprising enumerator somet,10083.0,hirnrntheres issuernrnrubyr,independent,0.0,
36.0,104.0,16289.0,problemrnrncurrently interpreter e,16345.0,propose ruby doesnt emit deprecation,relates,1.0,
261.0,1102.0,4264.0,beginrn justification ruby object various,6583.0,beginrnif user try bind port tha,independent,0.0,
484.0,780.0,6739.0,hi therernrnwhen wrapping single lin,10042.0,postfix rescue notation convenientbu,relates,1.0,
335.0,575.0,13335.0,mathn deprecated feature ye,10169.0,englishrnrnas mentioned,relates,1.0,
165.0,7046.0,9400.0,raising error without defining exce,13551.0,doesnt seem intuitive way,independent,0.0,
659.0,4958.0,6717.0,beginrnhow adding method act,9123.0,numericzero return true false num,independent,0.0,
73.0,6411.0,10590.0,getting current gc state gclatest gc info,4691.0,use private method rnrnreq,independent,0.0,
977.0,317.0,5534.0,started commenting feature,15612.0,sometimes local variable,independent,0.0,
1012.0,743.0,14164.0,hello everyone especially ruby core team,10423.0,patch also downloadable,independent,0.0,
1131.0,205.0,14915.0,method system implementation depen,14940.0,related add bcrypt password h,relates,1.0,
346.0,5441.0,10386.0,far research couldnt find reas,5123.0,read controversial decision,independent,0.0,
431.0,718.0,7793.0,would nice following method,4151.0,beginrn hirn rn method,relates,1.0,
574.0,375.0,6802.0,ruby method obtain array,12745.0,simplified stupid example replace som,relates,1.0,
406.0,13.0,16794.0,reading rassign,17353.0,since ruby already moving directionfu,relates,1.0,
597.0,6494.0,14041.0,nacl pnacl already sunset statusrnr,5006.0,occurs since rubygems us,independent,0.0,
937.0,5226.0,4830.0,array use item defaultrnfor hashe,15281.0,current implementation computes set intersecti,independent,0.0,
144.0,139.0,15752.0,believe introduce module exp,15966.0,feel frustrated recent experimenta,relates,1.0,
298.0,790.0,7340.0,following discussion,6687.0,beginrnlet propose enumerablewith,relates,1.0,
1437.0,1903.0,10273.0,watched matz recent keynote future,14170.0,nobu added ripperlexerstate,independent,0.0,
1093.0,6388.0,16773.0,minor patch help reduce alloca,13740.0,derived existing documentation,independent,0.0,
1137.0,638.0,3207.0,hirn rnthere issue reported abo,2149.0,precleaning path side c,independent,0.0,
217.0,1040.0,9112.0,module included class,1586.0,beginrn scenariorn include foo,relates,1.0,
969.0,341.0,13067.0,propose make trueclass falseclass,11286.0,proposalrnit proposed enumerable,relates,1.0,
740.0,5806.0,6868.0,beginrni propose make use,8571.0,currently refinement inherited mo,independent,0.0,
1410.0,2098.0,9553.0,ruby method acceptable argument co,6622.0,operator defined alias exi,independent,0.0,
975.0,898.0,6823.0,hirn rn ive previously reported coupl,5382.0,similar delimited string array,relates,1.0,
169.0,523.0,11207.0,make code maintainable,10445.0,ive made patch matrix return new,independent,0.0,
819.0,6333.0,13314.0,hashdig want assign,12133.0,intuitive approach would allow defin,independent,0.0,
1528.0,467.0,12019.0,nowadays almost every processor,11541.0,since ruby def return symbol th,relates,1.0,
147.0,1172.0,9556.0,kind alternative,10519.0,hello rnrnit seems ability fo,independent,0.0,
1564.0,3246.0,3246.0,beginn hirn rn currently yamlyamler,16137.0,abstractrnrnunboundmethod class,independent,0.0,
546.0,403.0,12512.0,think value transformation fundamental,9635.0,way directly map hash,relates,1.0,
946.0,43.0,12026.0,add simple way filter warning,17122.0,deprecation warning warning rub,relates,1.0,
880.0,5721.0,7114.0,beginrnas suggested drbrain,14411.0,wonder predicate method say secure,independent,0.0,
1268.0,5670.0,15287.0,abstractrnrni propose following new,16965.0,recent redhat kernel example rhel,independent,0.0,
1506.0,4466.0,13047.0,multiline prettyprinting multiline string,12262.0,loop method continues default,independent,0.0,
1363.0,1041.0,11375.0,pathnamerb many string literal,14092.0,dont work tempfile often every ti,independent,0.0,
512.0,95.0,16378.0,think important otherwise,16891.0,based feedback railscore matz de,relates,1.0,
207.0,534.0,11105.0,support hash literal,16095.0,common usern rubyrnclass arn de,relates,1.0,
722.0,1500.0,8572.0,im thinking fiber enumerable,1212.0,beginn doc arrayfill miss indicat,independent,0.0,
1378.0,178.0,15393.0,hirnrni would like add vm compilation,16600.0,contextrnrna somewhat common pattern w,relates,1.0,
1167.0,7750.0,5534.0,started commenting feature,11761.0,often want assign default value proc,independent,0.0,
650.0,430.0,12222.0,python statistic library calculati,12217.0,issue propose introduce enumerabl,relates,1.0,
595.0,727.0,15912.0,got report byebug byebug,17140.0,recent version ruby weve gotten new,independent,0.0,
621.0,946.0,4780.0,mentioned another rejected issue,4615.0,beginnfileeach linesep line c,relates,1.0,
1504.0,5368.0,3667.0,beginn dateformatrb dateformat,5789.0,prepared couple patch optimize st ta,independent,0.0,
1009.0,22.0,17273.0,proposal introduce shareable con,17278.0,description rnrnthis proposal aim,relates,1.0,
915.0,2975.0,13017.0,secure enough used hash,11517.0,im submitting patch enhance queuepop,independent,0.0,
662.0,866.0,5653.0,hirn rntoday talked nahi en,15592.0,feature switch autoload behav,relates,1.0,
1476.0,4523.0,17551.0,pattern matching powerful feature b,14143.0,extracted focus default v,independent,0.0,
1438.0,912.0,6552.0,current implementation enumeratorselec,9696.0,maintainer ruby facet core e,independent,0.0,
342.0,7502.0,4786.0,hello allrnrnas discussed,16491.0,complex regex string work fine,independent,0.0,
361.0,849.0,2021.0,beginn graduate student univer,10179.0,alternatively nethttp could detect,independent,0.0,
467.0,6971.0,11630.0,would create reliable alternative gem,11723.0,hi everyonernrni trying write li,independent,0.0,
1361.0,6109.0,17284.0,reason need provide way,10072.0,standard basis vector really important,independent,0.0,
1286.0,6645.0,11124.0,monotonic clock preferred guar,12871.0,arraysum us kahans algorithm float,independent,0.0,
1512.0,5236.0,17401.0,ractormovedobject frozen tha,7611.0,beginrnpresently ruby seven method,independent,0.0,
911.0,3763.0,11140.0,right rubygems cant handle call aut,15327.0,refinement enabled various context,independent,0.0,
976.0,7347.0,15818.0,common experience google,12008.0,hi know sort deep freeze c,independent,0.0,
868.0,3682.0,10376.0,long know nubyrnrni su,2065.0,beginrn implemented dsl add fe,independent,0.0,
1455.0,4826.0,5248.0,beginrnhellowrnrni wrote patch,9070.0,beginrnthis idea introduce,independent,0.0,
520.0,298.0,13618.0,rnauto fiber schedule rb wait sin,14736.0,ruby concurrency greatly enhanced co,relates,1.0,
1460.0,114.0,16253.0,using thisrnrnrubyrn def,16296.0,settled syntax rem,relates,1.0,
1379.0,1759.0,13517.0,rninstead relying native conditio,6612.0,beginrncurrently way control,independent,0.0,
354.0,123.0,8468.0,yesterday github tokyo drinkup thanks gi,16131.0,ruby taint checking originally,relates,1.0,
832.0,4804.0,13303.0,proposed containernonempty,17259.0,kernelwarn currently skip intern,independent,0.0,
1078.0,4153.0,8437.0,ruby language currently one support,10982.0,ruby error nomethoderror happens,independent,0.0,
159.0,509.0,11473.0,matz said string literal immutable,8976.0,yesterday facetoface developer mee,relates,1.0,
100.0,7275.0,17414.0,current situation limitingrnrnu,11817.0,id like suggest new method parallelr,independent,0.0,
1016.0,524.0,5695.0,hellornrnplease add isnt keywo,14644.0,dirglob dir accepts separat,independent,0.0,
1513.0,4249.0,5206.0,ruby run change defaul,17472.0,rail activesupporthashwithindifferenta,independent,0.0,
501.0,581.0,13123.0,hashdig often variab,7914.0,beginrnhere use case local class,independent,0.0,
1486.0,539.0,11346.0,dont think would good idea,11066.0,hi first report please bear wit,relates,1.0,
1405.0,689.0,11537.0,sometimes write following code rail ap,8237.0,beginrnthis feature suggestion wa,relates,1.0,
231.0,525.0,11256.0,since capturing block proc slow f,14045.0,backgroundrnrnif need pas given b,relates,1.0,
122.0,1323.0,6210.0,load currently take optional second argume,9328.0,pointless check cloexec work af,independent,0.0,
136.0,5209.0,5658.0,beginrncurrently method mkmf,13333.0,currently block take block bl,independent,0.0,
466.0,537.0,13588.0,implementing iolike object id like,11094.0,originally defined codespace,relates,1.0,
626.0,7398.0,14410.0,patch rnrn,3773.0,beginrn sure parent best name,independent,0.0,
1194.0,7524.0,14114.0,must discussed beforernpleas,15378.0,using ruby try save ur,independent,0.0,
830.0,701.0,12173.0,frequent time instancer,8096.0,beginrna lot scenario application,relates,1.0,
325.0,967.0,4151.0,beginrn hirn rn method,6669.0,given hash hmap return arrayali,relates,1.0,
1490.0,981.0,4038.0,beginn discussed suggest wr,4015.0,beginn couple flag li,relates,1.0,
589.0,6154.0,3875.0,beginn naive implementation backtrace,6315.0,using similar mechanism set trace func,independent,0.0,
1362.0,6310.0,8042.0,add socket method addrinfo get,13574.0,hirnrnif redefine method like,independent,0.0,
993.0,4854.0,13936.0,ruby kind feature allow pr,10267.0,method obtain number process,independent,0.0,
47.0,3247.0,6895.0,beginrn abstractrnrnlets introduce tr,10254.0,order allow iteration element,independent,0.0,
370.0,292.0,13765.0,proc curry,7939.0,beginrni really like new assuming,relates,1.0,
306.0,6896.0,8083.0,beginrnwindows us process exit cod,10123.0,broken using rnrnrn echo,independent,0.0,
489.0,2151.0,13208.0,found need recently class,13626.0,common pattern io buffering read,independent,0.0,
28.0,3003.0,12268.0,use extend self instead mod,6277.0,beginrnmany time hash uniform key,independent,0.0,
1140.0,960.0,4276.0,current syntactic sugar allows thisrnrn,4801.0,assuming there technical limitation,relates,1.0,
686.0,3257.0,16175.0,new keyword freeze intro,12676.0,earlier posted code simplify prime di,independent,0.0,
1309.0,912.0,6482.0,beginrnthis patch add full uri request,5064.0,currently problem netht,relates,1.0,
1149.0,79.0,15393.0,hirnrni would like add vm compilation,16600.0,contextrnrna somewhat common pattern w,relates,1.0,
1014.0,2116.0,13587.0,patch add preallocation string,10098.0,could totally wrong seems sta,independent,0.0,
446.0,52.0,16989.0,opening series feature request,16991.0,id like add join setrnrnru,relates,1.0,
1364.0,199.0,14609.0,abstractrnrnkernelpobj print obj,15112.0,sometimes write stderrputs objinspect,relates,1.0,
1096.0,4765.0,12205.0,attached git diff update missingstrlcat,5716.0,latest ruby warning ena,independent,0.0,
99.0,6483.0,16763.0,msc ver differs previous version,15612.0,sometimes local variable,independent,0.0,
142.0,44.0,12299.0,another attempt provide ty,17122.0,deprecation warning warning rub,relates,1.0,
1057.0,38.0,17055.0,two verbose mode warning fairl,17143.0,support recently added warningwarn,relates,1.0,
1355.0,7692.0,5976.0,beginrni suggest abolition calculati,17109.0,intersection b union,independent,0.0,
691.0,567.0,10329.0,followupto feature optimize recv,10326.0,concatenating literal string existing stri,relates,1.0,
13.0,890.0,13261.0,issue tracking gem release sdbm,5481.0,beginrnrnuptodate summary propo,relates,1.0,
140.0,4098.0,9515.0,io class pair class meth,15624.0,currently nethttp hasrnrnrn def,independent,0.0,
630.0,222.0,14759.0,everybody benefit jemalloc e,15667.0,per honglis excellent article look like,relates,1.0,
572.0,408.0,12546.0,unicodenormalizeunicode version defined,12460.0,currently unicode version used speci,relates,1.0,
1351.0,444.0,12086.0,currently refinement activated,16461.0,overviewrni propose procusing support,relates,1.0,
965.0,5096.0,16703.0,often see code intends remove port,14187.0,currently mri many test suite bootstr,independent,0.0,
624.0,406.0,7684.0,noticed nethttpheaderset form data,6481.0,ive added paul mcmahons patch gh,independent,0.0,
1341.0,291.0,13765.0,proc curry,6817.0,know propose significa,relates,1.0,
844.0,4468.0,5805.0,would like see object hexid added rub,14098.0,miss important information howt,independent,0.0,
1434.0,572.0,10052.0,implementation queue sizedqueue ha,16688.0,often work pathname object p,independent,0.0,
87.0,68.0,16786.0,abstractrnrnwe propose introduce li,16792.0,currently mutex cruby held per thread,relates,1.0,
1307.0,119.0,9960.0,please consider adding gnu long option equiv,10532.0,analogous functionality found io,independent,0.0,
1280.0,854.0,5781.0,pretty sure come id l,12046.0,write accessor method bo,relates,1.0,
726.0,753.0,7793.0,would nice following method,7292.0,official method expl,relates,1.0,
714.0,720.0,10552.0,counting many time value appears som,7793.0,would nice following method,relates,1.0,
558.0,6544.0,4742.0,currently option fileopen,16168.0,ruby method implemented function,independent,0.0,
