Unnamed: 0,Unnamed: 0.1,id1,Description1,id2,Description2,Type of dependency,label,AnnotationStatus
1297.0,2691.0,15606.0,seem issue method,9260.0,read force flag ignores stan,independent,0.0,
580.0,442.0,12092.0,allows creating modified clone frozen,14778.0,id like use objectdup block whi,relates,1.0,
1318.0,86.0,16378.0,think important otherwise,16463.0,ruby outrnit aim warn ever,relates,1.0,
1261.0,2831.0,12858.0,hello short proposal unlike,15588.0,stringeach chunk iterates chunk specified,independent,0.0,
232.0,999.0,3426.0,beginrn documentation exec state,2715.0,beginrn old issue think going,relates,1.0,
1306.0,770.0,6817.0,know propose significa,4539.0,inspired haskells zipwith function ha,relates,1.0,
1176.0,165.0,12240.0,often improvement implicit block argume,15741.0,numbered parameter introduced,relates,1.0,
1367.0,412.0,12447.0,sometimes want extract digit placeva,16011.0,ruby seems way format number w,relates,1.0,
382.0,5660.0,10982.0,ruby error nomethoderror happens,14788.0,sometimes need fetch k,independent,0.0,
1304.0,261.0,14133.0,module class reopened change,6539.0,feel inconsistency meth,relates,1.0,
547.0,1821.0,14386.0,sometimes write code likernrn rubyr,12161.0,bigdecimals inspect humanfriend,independent,0.0,
523.0,45.0,17100.0,ractor proposal new concurrent abst,17145.0,id like propose objectdeep freezern,relates,1.0,
1116.0,433.0,12173.0,frequent time instancer,8640.0,hirnrnwe time many thing rail,relates,1.0,
153.0,1003.0,3187.0,beginrn id like way increase size,6694.0,abstractrnrnsupport threadnew without,relates,1.0,
79.0,1000.0,3388.0,beginrn abcdefghijstar,13712.0,stringstart receive regexprn,relates,1.0,
340.0,1649.0,5767.0,patch add caching expanded load path,13574.0,hirnrnif redefine method like,independent,0.0,
1136.0,2072.0,10561.0,working issue rail hit,10683.0,find way global function hash aka,independent,0.0,
1464.0,703.0,12497.0,benchmark program pidigitsrb,5101.0,proposed api would bernrn tcpsocketnew,independent,0.0,
1509.0,679.0,12461.0,would nice hash way create,8499.0,according experience following two,relates,1.0,
66.0,1011.0,3426.0,beginrn documentation exec state,2715.0,beginrn old issue think going,relates,1.0,
754.0,4697.0,7145.0,imap protocol support fetching range,4778.0,manipulating text file mostly inpu,independent,0.0,
451.0,7707.0,5554.0,often want apply proc self sel,5669.0,little idea popped headr,independent,0.0,
741.0,4052.0,16838.0,ruby enumeratorrnrn ru,15589.0,understanding predicate method,independent,0.0,
225.0,577.0,10152.0,stringstrip doesnt remove nonbreaking space,10085.0,case conversion function currently limite,relates,1.0,
138.0,385.0,12648.0,would like pas optional argument,15725.0,hellornrni would like propose four new,relates,1.0,
303.0,6219.0,10340.0,add example term underscore given,9634.0,ive written patch collect symbol,independent,0.0,
1142.0,270.0,9049.0,nmatrix weve implemented range shortha,14044.0,described numonarray pycal,relates,1.0,
764.0,5870.0,11607.0,external function wish call may tak,13050.0,patch make gnu readline variable rl,independent,0.0,
591.0,3592.0,10034.0,reducing struct pattern buffer,1147.0,beginn please improve fileexpand path,independent,0.0,
611.0,4260.0,4553.0,beginrna common operation set,14877.0,seems like there enough complexity determ,independent,0.0,
1450.0,6398.0,13221.0,part standard library ruby,6717.0,beginrnhow adding method act,independent,0.0,
729.0,1694.0,13314.0,hashdig want assign,10064.0,put proc object clause,independent,0.0,
441.0,874.0,11025.0,rake follow testunit minitest,5481.0,beginrnrnuptodate summary propo,relates,1.0,
1310.0,6605.0,15632.0,ruby new method referenc,13252.0,hirnrnid like c api allow,independent,0.0,
1150.0,1043.0,4512.0,beginrnits use,1291.0,beginrn linux useful cloex,relates,1.0,
919.0,903.0,5112.0,first working inadvertent sy,5072.0,recently discovered denial service vuln,relates,1.0,
248.0,5405.0,14832.0,netreadtimeout occurs cant get,6390.0,xyxyrnxyxyrnxy xyrn,independent,0.0,
1184.0,355.0,12921.0,env like,10652.0,get user pas variable whe,relates,1.0,
468.0,4746.0,16971.0,following pattern mean basically,8683.0,csv library add new row,independent,0.0,
347.0,1013.0,12047.0,add set alias setinclude,13934.0,hello rubycore team everyone elsernr,independent,0.0,
396.0,3212.0,14606.0,rubyrnbeginrn foornelsern,3285.0,beginn current bigdecimal managed,independent,0.0,
376.0,886.0,8539.0,unbundling exttk ruby reposito,5481.0,beginrnrnuptodate summary propo,relates,1.0,
755.0,200.0,11925.0,propose make struct subclass constructor w,15076.0,struct used instantiate object,relates,1.0,
845.0,100.0,14145.0,idea investigating example scrip,16356.0,current behavior includes rnis th,relates,1.0,
1135.0,6232.0,10237.0,find sometimes convert one,11122.0,would like reduce exception nonbloc,independent,0.0,
1336.0,416.0,12247.0,found useful arraydelete,12333.0,would like stringconcat arrayconcat,relates,1.0,
295.0,7702.0,8452.0,imagine code like rn long,16815.0,previously discussed,independent,0.0,
1257.0,4194.0,7274.0,beginrnas corollary unboundmethods,16557.0,pull request,independent,0.0,
1312.0,4386.0,10519.0,hello rnrnit seems ability fo,6668.0,currently multiple assignment,independent,0.0,
951.0,5504.0,13933.0,range already responds size would n,14465.0,rnthe method name send udpsocket,independent,0.0,
905.0,166.0,12648.0,would like pas optional argument,15725.0,hellornrni would like propose four new,relates,1.0,
1487.0,2732.0,12654.0,window ntfs support unicode,8683.0,csv library add new row,independent,0.0,
907.0,570.0,12217.0,issue propose introduce enumerabl,10298.0,propose arrayfloat sum arrayc,relates,1.0,
259.0,2133.0,13174.0,reduce size id table platfo,7519.0,limitation module g,independent,0.0,
68.0,2526.0,11534.0,rubyrndef foorn f,16638.0,sysloglogger appears conform,independent,0.0,
83.0,1997.0,8709.0,o dirglob dir return ordered,15123.0,hirnrnwhile enumerable provide,independent,0.0,
680.0,504.0,11997.0,request single method read file wh,15804.0,currently implementation beginendles,independent,0.0,
1530.0,67.0,16794.0,reading rassign,17353.0,since ruby already moving directionfu,relates,1.0,
1330.0,421.0,12299.0,another attempt provide ty,17122.0,deprecation warning warning rub,relates,1.0,
1546.0,824.0,6298.0,beginrnmaybe another way thi,5007.0,im proposing method called proccall,relates,1.0,
658.0,688.0,8237.0,beginrnthis feature suggestion wa,8191.0,beginrnas ducktyped language ruby,relates,1.0,
829.0,1154.0,15778.0,hellornrnim maintainer webco,11791.0,frequently use literal quoting aka w,independent,0.0,
170.0,6488.0,12810.0,hello everyonernrnive toyed bit,13095.0,ioc rb syscall remove deprecation notice,independent,0.0,
1283.0,452.0,12046.0,write accessor method bo,15991.0,hirnrni thought issue wouldve al,relates,1.0,
274.0,6408.0,7849.0,even though symbol technically hon,11124.0,monotonic clock preferred guar,independent,0.0,
1.0,735.0,7378.0,variant filewrite pa,7360.0,currently pathnameglob method,relates,1.0,
1393.0,6366.0,8272.0,proposal accepted well nee,13494.0,rnwe method type bit,independent,0.0,
367.0,799.0,13006.0,hello right difficulty u,6647.0,many application user dealt,relates,1.0,
799.0,6743.0,12746.0,code worksrnrn array b,14989.0,hi thererni gsoc student following ko,independent,0.0,
823.0,7512.0,14084.0,id like propose new method enumerato,13389.0,already applied fix smtp httprn,independent,0.0,
791.0,982.0,4038.0,beginn discussed suggest wr,4015.0,beginn couple flag li,relates,1.0,
963.0,4204.0,13250.0,nobu response issue,8546.0,unboundmethods unable call superr,independent,0.0,
305.0,4377.0,2643.0,beginrn hi ryan davis rn rn wri,2523.0,beginn whats proper procedure check,independent,0.0,
807.0,160.0,14844.0,hi thanks great work ruby,15752.0,believe introduce module exp,relates,1.0,
1013.0,2608.0,15085.0,mjit make rubymethods faster ordinary bu,9770.0,etcuname method call,independent,0.0,
477.0,3077.0,5494.0,proposal improved finalizer semanticsrnr,15964.0,patch implement rfc,independent,0.0,
1121.0,892.0,5481.0,beginrnrnuptodate summary propo,15657.0,maintenance webrick hard rub,relates,1.0,
196.0,418.0,12306.0,time rejected featur,8110.0,useful method allowing pattern,relates,1.0,
545.0,769.0,6823.0,hirn rn ive previously reported coupl,5453.0,gemspec added automodea,relates,1.0,
1403.0,169.0,10571.0,kind curiosity far searched,14857.0,abstractrnrncollect malloc related inf,independent,0.0,
1163.0,470.0,7508.0,related cleaned call,13703.0,locale encoding misleading since,independent,0.0,
123.0,268.0,14045.0,backgroundrnrnif need pas given b,14267.0,following script consistently print proc,relates,1.0,
1108.0,773.0,13765.0,proc curry,6817.0,know propose significa,relates,1.0,
1253.0,445.0,6775.0,beginrn abstractrnrnregexpmatch,11865.0,like attribute lineno csv c,independent,0.0,
8.0,6871.0,17157.0,warning say removed ruby,9253.0,hellornrnive notice there mean u,independent,0.0,
442.0,983.0,3917.0,beginrn propose introduce kernelcalle,1906.0,beginrn inspired nobus recent refactori,relates,1.0,
12.0,1669.0,8190.0,begin rn,10322.0,ive added line indicating st,independent,0.0,
1287.0,4942.0,13415.0,would consider distributing gitignore,14043.0,found dont method,independent,0.0,
114.0,953.0,4512.0,beginrnits use,1291.0,beginrn linux useful cloex,relates,1.0,
1185.0,4886.0,7511.0,find need logical implication use,4865.0,documentation fileutils unclear,independent,0.0,
1415.0,1564.0,5528.0,would nice see better api set,13047.0,multiline prettyprinting multiline string,independent,0.0,
719.0,227.0,4100.0,beginn attached patch reorganizes fu,4569.0,beginrnhellornrnfollowing discussi,independent,0.0,
268.0,4614.0,3021.0,beginn arraypermutation combination wi,12008.0,hi know sort deep freeze c,independent,0.0,
1222.0,1036.0,3917.0,beginrn propose introduce kernelcalle,1906.0,beginrn inspired nobus recent refactori,relates,1.0,
1496.0,4444.0,12664.0,following additionrnrn rubyrncla,16049.0,decision made frozen string,independent,0.0,
1424.0,5001.0,4447.0,beginnplease add stringbyteslice method,10634.0,add method benchmarkreportbaseline,independent,0.0,
1051.0,692.0,8237.0,beginrnthis feature suggestion wa,8191.0,beginrnas ducktyped language ruby,relates,1.0,
505.0,224.0,14736.0,ruby concurrency greatly enhanced co,16786.0,abstractrnrnwe propose introduce li,relates,1.0,
186.0,5997.0,16348.0,replacing match start end w,11599.0,hirnrnthis first code contributi,independent,0.0,
35.0,531.0,13137.0,update javascript added object shor,11105.0,support hash literal,relates,1.0,
34.0,826.0,13600.0,one main use case would make yie,6284.0,would nice able compose procs l,relates,1.0,
279.0,314.0,13334.0,mathncomplex mathnrational deprec,17281.0,mathn deprecated canonicalization,relates,1.0,
172.0,1319.0,7145.0,imap protocol support fetching range,16336.0,purpose constant privacy keep c,independent,0.0,
163.0,5757.0,6243.0,super ruby developerrni want make ru,12057.0,trying figure yield work pyth,independent,0.0,
455.0,3042.0,14887.0,class inherits array del,12211.0,proposes new method datefirst month,independent,0.0,
1422.0,6147.0,15251.0,im sure current behavior expected,8707.0,currently reverse call enumerablere,independent,0.0,
1005.0,2614.0,4270.0,beginrn resolvgetaddresses cannot handle,11882.0,hash one best feature ruby,independent,0.0,
32.0,678.0,9108.0,hirnrni seem regularly requir,8499.0,according experience following two,relates,1.0,
469.0,5646.0,17328.0,ive opened pr,13963.0,like expensive slo,independent,0.0,
628.0,668.0,8579.0,id like propose new type string liter,8906.0,integer float object frozen obje,relates,1.0,
1034.0,11.0,10600.0,multipleproducer multipleconsumer sit,17357.0,currently difficult reliably distingu,relates,1.0,
1543.0,5020.0,11647.0,implementation detail,3085.0,beginn due precision timestamp tha,independent,0.0,
537.0,4015.0,8217.0,current opensslbnnew get string,12574.0,believe true false nil lo,independent,0.0,
139.0,902.0,5120.0,example showing surprising inc,3575.0,currently work like thisrnrnrubyrn,relates,1.0,
388.0,410.0,12447.0,sometimes want extract digit placeva,4787.0,suggest new feature integer enumerat,relates,1.0,
1288.0,7078.0,15074.0,currently working ruby api basically,14146.0,generate hash object heap area st,independent,0.0,
1180.0,788.0,12134.0,need sort element dependin,8027.0,imo exception hook method b,independent,0.0,
1488.0,4339.0,6545.0,found testdltest structunion ent,9140.0,possible arrayeach,independent,0.0,
775.0,526.0,11252.0,matz hope integrate mean gem r,11032.0,hi guysrnrnwhen younger class,relates,1.0,
1338.0,726.0,8271.0,proposal moving visible formal,7549.0,matzrnrnat rubyconf gave talk,relates,1.0,
1551.0,2195.0,6353.0,relating keyword argument ar,9071.0,see discussion,independent,0.0,
1178.0,738.0,7378.0,variant filewrite pa,7363.0,year ago sumbitted yet accept,relates,1.0,
141.0,6899.0,6819.0,beginrnopenssldigestnew allows,13936.0,ruby kind feature allow pr,independent,0.0,
690.0,5899.0,12080.0,propose new feature enumerablearrayran,5337.0,beginrni propose using outbufs fileutils,independent,0.0,
536.0,729.0,7067.0,hellornrni think ioreopen accept,12639.0,patch make requiring alreadyloaded f,independent,0.0,
332.0,329.0,13186.0,issue tracking gem release zlib,5481.0,beginrnrnuptodate summary propo,relates,1.0,
500.0,916.0,5044.0,reason zip doesnt return r,4539.0,inspired haskells zipwith function ha,relates,1.0,
635.0,405.0,10208.0,convert list key value,12512.0,think value transformation fundamental,relates,1.0,
847.0,788.0,3187.0,beginrn id like way increase size,6694.0,abstractrnrnsupport threadnew without,relates,1.0,
1454.0,6182.0,13626.0,common pattern io buffering read,14104.0,abstractrnrnremove trace instruction,independent,0.0,
1202.0,7644.0,12304.0,would like stringsplit take optiona,6679.0,let change default encoding ruby sou,independent,0.0,
95.0,4233.0,5623.0,add documentation complex,7872.0,beginrnis expected behaviorrnr,independent,0.0,
812.0,345.0,12996.0,proposal range optimize red,12612.0,currently range alias includ,relates,1.0,
1146.0,6981.0,15759.0,past year rust proven,10658.0,here story wrote testing framework,independent,0.0,
770.0,262.0,14132.0,module class reopened change,6539.0,feel inconsistency meth,relates,1.0,
1270.0,741.0,7378.0,variant filewrite pa,7361.0,pathname mkdir method create dire,relates,1.0,
1352.0,557.0,10552.0,counting many time value appears som,9970.0,method simplify two common pattern whe,relates,1.0,
509.0,954.0,4477.0,documentation common sense would e,2715.0,beginrn old issue think going,relates,1.0,
411.0,533.0,11105.0,support hash literal,14579.0,allow value omission hash lite,relates,1.0,
1073.0,909.0,5065.0,ive noticed issue subjecting endal,5054.0,though matz said ruby,relates,1.0,
447.0,644.0,8897.0,propose ruby support client side tcp f,8871.0,propose ruby support server side tcp fa,relates,1.0,
205.0,1033.0,17006.0,sometimes need create hash e,10197.0,good idea implementationinternalsdepe,independent,0.0,
1429.0,85.0,16463.0,ruby outrnit aim warn ever,16511.0,alternative id lik,relates,1.0,
997.0,1037.0,5016.0,calling kernelcaller negative limit sh,1906.0,beginrn inspired nobus recent refactori,relates,1.0,
1303.0,454.0,10641.0,hellorni propose introduce fixnumfinit,12039.0,issue easy ask,relates,1.0,
1043.0,1798.0,17219.0,hellornrnurihostname extends urihost wi,10602.0,current rb profile frame capture f,independent,0.0,
1065.0,534.0,11643.0,posted mailing list last year,7918.0,currently ruby library way detect,independent,0.0,
854.0,202.0,14830.0,ticket picking mjitpause ht,14954.0,problemrnto measure mjitgenerated cod,relates,1.0,
1029.0,2436.0,11882.0,hash one best feature ruby,16667.0,allow parameter symbolto proc method,independent,0.0,
84.0,456.0,12026.0,add simple way filter warning,17122.0,deprecation warning warning rub,relates,1.0,
596.0,2262.0,10426.0,occasionally felt necessity predica,15231.0,object receives discard ar,independent,0.0,
91.0,530.0,6613.0,support vt record variant,6758.0,beginrnrn objectsequencernrnlet,independent,0.0,
166.0,6277.0,11629.0,list exception raised netsm,4093.0,beginn ive reworked main nethttp rdoc,independent,0.0,
195.0,5657.0,5460.0,nethttp sends connect request comm,16233.0,deal specifically setting,independent,0.0,
1265.0,387.0,14423.0,upd current proposalrnrnintroduce met,9686.0,symbol often used literally key ha,independent,0.0,
637.0,7740.0,7788.0,beginrni endeavoured add proper sch,13585.0,element returned select,independent,0.0,
687.0,6149.0,11390.0,currently possible create symbo,10498.0,problemrnrnteaching ruby always end,independent,0.0,
717.0,862.0,13784.0,ruby full set functional tool,5663.0,pretty common want map en,relates,1.0,
906.0,6662.0,14114.0,must discussed beforernpleas,6769.0,beginrnhellornrncurrent behavior rb,independent,0.0,
1106.0,34.0,2509.0,beginrn like freezing constant confi,17145.0,id like propose objectdeep freezern,relates,1.0,
935.0,971.0,15446.0,stringeach match would two formsrn,6638.0,many library use array queue cause stdli,independent,0.0,
151.0,5892.0,11710.0,setmerge method currently mutates cal,11087.0,rail implemented objectinstance valueshtt,independent,0.0,
1453.0,6801.0,16017.0,recently began study ruby lack th,12754.0,arraypack always return new allocated str,independent,0.0,
1074.0,1744.0,15353.0,tl server request client certific,13801.0,keeping class semantics set sho,independent,0.0,
1397.0,605.0,11420.0,let introduce id key table optimization,9638.0,allow better use cachefriendly,relates,1.0,
1389.0,1915.0,17258.0,descriptionrnrnid like propose addin,2190.0,beginrn hellorn rn request file,independent,0.0,
664.0,180.0,12460.0,currently unicode version used speci,15341.0,emoji version different unicod,relates,1.0,
967.0,1028.0,10085.0,case conversion function currently limite,2034.0,beginrn consideration recently giv,relates,1.0,
90.0,208.0,14912.0,propose new pattern matching syntaxrnrn,15918.0,currently set respond deconstr,relates,1.0,
267.0,96.0,16378.0,think important otherwise,16463.0,ruby outrnit aim warn ever,relates,1.0,
272.0,3940.0,9502.0,id like remove deprecated definitionsrn,15004.0,rubyspec single codebase supporting,independent,0.0,
1040.0,6822.0,11309.0,hinted problem stackoverflo,10261.0,right test method testmathassert infi,independent,0.0,
848.0,717.0,7793.0,would nice following method,6669.0,given hash hmap return arrayali,relates,1.0,
56.0,4188.0,4093.0,beginn ive reworked main nethttp rdoc,16754.0,help message help getting longer,independent,0.0,
888.0,2498.0,7791.0,lot denialofservice security vulnerabili,16035.0,go one step farther nobu,independent,0.0,
456.0,1052.0,16336.0,purpose constant privacy keep c,6588.0,setsuperset setsubset,independent,0.0,
1471.0,438.0,10861.0,netbsd openbsd use mandoc manual,8887.0,adding optional argument,independent,0.0,
600.0,497.0,12019.0,nowadays almost every processor,11541.0,since ruby def return symbol th,relates,1.0,
1508.0,977.0,4071.0,beginn support basic auth nethttpget,3848.0,beginrn hirn rn needed download,relates,1.0,
89.0,3519.0,12665.0,current version method prime,5528.0,would nice see better api set,independent,0.0,
671.0,265.0,14097.0,currently concat method ruby whi,14105.0,sure also add feautures th,relates,1.0,
841.0,700.0,8640.0,hirnrnwe time many thing rail,8096.0,beginrna lot scenario application,relates,1.0,
669.0,6888.0,16666.0,sorry brought,11737.0,ruby case expression scenario allows,independent,0.0,
1055.0,10.0,15973.0,kernellambda receives proc,17361.0,newsrnrnrn kernellambda,relates,1.0,
1484.0,827.0,5008.0,beginrnhellornrni using ruby,6276.0,dear matzrnrnwe establish,relates,1.0,
1469.0,170.0,5653.0,hirn rntoday talked nahi en,15592.0,feature switch autoload behav,relates,1.0,
1260.0,948.0,5138.0,current ruby io class nonblocking,4560.0,blindly hitting ioread nonblock raising,relates,1.0,
398.0,5279.0,15829.0,id like propose sugar objectthen,12459.0,suggest little new feature liboptparse,independent,0.0,
29.0,6487.0,10090.0,aix process listing displayed th,6270.0,would work like thisrnrn foo,independent,0.0,
543.0,516.0,11346.0,dont think would good idea,11066.0,hi first report please bear wit,relates,1.0,
503.0,1011.0,7051.0,new caller location api allows one get,9020.0,summaryrnrni would like propose addin,independent,0.0,
146.0,7479.0,10366.0,currently rational inspection expressed wi,7220.0,calling stringioinitialize copy cause tw,independent,0.0,
1337.0,131.0,12046.0,write accessor method bo,15991.0,hirnrni thought issue wouldve al,relates,1.0,
187.0,279.0,13984.0,currently bigdecimal instance frozen,13985.0,since truefalsenilintegerfloat jus,relates,1.0,
395.0,6954.0,16673.0,nethttp allows setting open timeout,10165.0,patch change benchmarkrealtime meth,independent,0.0,
1384.0,5497.0,13551.0,doesnt seem intuitive way,15527.0,timezone support introduc,independent,0.0,
701.0,952.0,4512.0,beginrnits use,5041.0,id like set fd cloexec file descri,relates,1.0,
218.0,2619.0,14666.0,hi everyone rubytrunkrnrni encountered,13667.0,since cant rubyvminstructionsequenceto,independent,0.0,
898.0,766.0,6946.0,beginrnhi running test suite fips e,6943.0,chance make pstore compatible,relates,1.0,
174.0,6493.0,4016.0,beginn please consider adding age unicod,5157.0,unused variable uglyrnrnas often,independent,0.0,
974.0,950.0,14815.0,benchmarkdriverrb add cpu time measurement,10867.0,case rb atomic type retrieved,independent,0.0,
629.0,346.0,12996.0,proposal range optimize red,14575.0,conscious duplicate bug,relates,1.0,
1173.0,207.0,14912.0,propose new pattern matching syntaxrnrn,15865.0,adding syntax oneline pattern,relates,1.0,
1119.0,1899.0,9830.0,hello everyonernrnwere required use g,2306.0,beginn split string class,independent,0.0,
158.0,1969.0,7614.0,beginrnprior issue reminded ive,1927.0,beginrn function rb readdir seems,independent,0.0,
968.0,6952.0,17111.0,diffrnrndiffrndiff git alibnet,14585.0,abstractrnrni propose add method,independent,0.0,
661.0,51.0,16989.0,opening series feature request,16992.0,officially set element uncertain order,relates,1.0,
177.0,707.0,16425.0,thread method like array ha,12304.0,would like stringsplit take optiona,independent,0.0,
1435.0,244.0,7639.0,chain method period e,14463.0,coming language find extre,relates,1.0,
1069.0,2536.0,9557.0,often happens want move curre,11737.0,ruby case expression scenario allows,independent,0.0,
1192.0,797.0,12512.0,think value transformation fundamental,6669.0,given hash hmap return arrayali,relates,1.0,
1368.0,69.0,16786.0,abstractrnrnwe propose introduce li,16792.0,currently mutex cruby held per thread,relates,1.0,
423.0,545.0,11252.0,matz hope integrate mean gem r,11032.0,hi guysrnrnwhen younger class,relates,1.0,
1088.0,1046.0,1201.0,beginrn possible use relati,1200.0,beginrn possible use named,relates,1.0,
1441.0,1868.0,4772.0,hi want add new method hashadd k,5866.0,ive come across time time,independent,0.0,
103.0,4257.0,15289.0,abstractrnrnto enable tracepoint spe,9585.0,please add method object,independent,0.0,
115.0,451.0,5781.0,pretty sure come id l,12046.0,write accessor method bo,relates,1.0,
698.0,563.0,5976.0,beginrni suggest abolition calculati,5677.0,related proposal rubycore,independent,0.0,
1426.0,4848.0,5550.0,often hash whose value recursively,3246.0,beginn hirn rn currently yamlyamler,independent,0.0,
936.0,4138.0,16686.0,need write script requesting h,14919.0,important multibyte string editing u,independent,0.0,
541.0,2615.0,6615.0,patch switch zstream run usin,9532.0,wondering could type ch,independent,0.0,
1237.0,284.0,12698.0,frequent need delete substring f,13890.0,currently stringcount accepts string,relates,1.0,
1248.0,137.0,8693.0,def yield end def,15973.0,kernellambda receives proc,relates,1.0,
1308.0,872.0,5543.0,first rb thread blocking region requires th,4328.0,beginrn think general enough rem,relates,1.0,
859.0,1748.0,4588.0,beginrnpassing hash env paramete,2170.0,beginn method object doesnt expose wr,independent,0.0,
920.0,437.0,12125.0,hellornrnthe operator let one pas,16275.0,objmethod introduced,relates,1.0,
178.0,6367.0,8684.0,propose gcdisable blockrnit usef,11801.0,current rb inspect raise encodingcompatibil,independent,0.0,
1212.0,6224.0,3653.0,beginrn expression ab applie,17157.0,warning say removed ruby,independent,0.0,
1325.0,4505.0,11735.0,hirnrni using stringsqui,14694.0,currently cannot get block parameter,independent,0.0,
300.0,656.0,8661.0,currently way ruby print backtrace th,16684.0,mostrecentcalllast order backtrace,relates,1.0,
1447.0,204.0,14915.0,method system implementation depen,14940.0,related add bcrypt password h,relates,1.0,
1532.0,1469.0,4551.0,beginrnfrom rfc section,14506.0,cmdarg stack stack byte,independent,0.0,
1561.0,880.0,13183.0,issue tracking gem release date,5481.0,beginrnrnuptodate summary propo,relates,1.0,
137.0,159.0,15752.0,believe introduce module exp,15966.0,feel frustrated recent experimenta,relates,1.0,
502.0,2890.0,8938.0,automatic keyword block variabler,13045.0,following methodrnrn rubyrndef,independent,0.0,
971.0,1437.0,7426.0,eric hodel planning update rdoc e,3888.0,beginn macports updated autoconf,independent,0.0,
918.0,5549.0,7519.0,limitation module g,10851.0,common pattern codernmatch,independent,0.0,
886.0,858.0,5690.0,would great way dynami,5666.0,would like make rb public ap,relates,1.0,
836.0,659.0,8777.0,hirnrnthis related mach ab,8658.0,adding new method processclock g,relates,1.0,
70.0,1014.0,1279.0,beginrn please add relevant dtrace prob,2565.0,beginrn hirn rn made commit e,relates,1.0,
1156.0,938.0,4276.0,current syntactic sugar allows thisrnrn,4801.0,assuming there technical limitation,relates,1.0,
283.0,1017.0,2348.0,beginrn merit library bee,9121.0,rbtree slower pure ruby versionr,relates,1.0,
