Unnamed: 0,Unnamed: 0.1,id1,Description1,id2,Description2,Type of dependency,label,AnnotationStatus
419.0,655.0,10420.0,gcm cipher accepts variable iv length rub,8667.0,hellorn rn openssl allowed,relates,1.0,
679.0,4407.0,7546.0,beginrnthis concrete proposal fix,16027.0,abstractrnrni propose ruby dtrac,independent,0.0,
525.0,771.0,6817.0,know propose significa,6373.0,recently suggested extens,relates,1.0,
1207.0,7742.0,6646.0,feature mentioned shortcoming,8262.0,trying use minus operator,independent,0.0,
1037.0,2221.0,13544.0,currently way load instruction,10361.0,found weird openuri accepts read ti,independent,0.0,
310.0,7246.0,9140.0,possible arrayeach,2771.0,beginn believe following simple constr,independent,0.0,
201.0,78.0,12650.0,window environment variable support unicode,16604.0,issue related,relates,1.0,
813.0,3451.0,8300.0,anyone help figure errorrn,13981.0,openbsd machine us mandoc format man,independent,0.0,
1534.0,449.0,12075.0,sometimes write following codernrnru,17330.0,always core method proposal,relates,1.0,
337.0,676.0,8568.0,fixnumsize really useful represent,8553.0,changing bignumsize well defin,relates,1.0,
634.0,589.0,10552.0,counting many time value appears som,9970.0,method simplify two common pattern whe,relates,1.0,
368.0,4364.0,14606.0,rubyrnbeginrn foornelsern,11145.0,msg dontwait enough force nonblocking,independent,0.0,
1183.0,724.0,7639.0,chain method period e,14463.0,coming language find extre,relates,1.0,
397.0,450.0,11167.0,hi guysrnrnhi nobu rnrnalso hi matz,12046.0,write accessor method bo,relates,1.0,
1107.0,882.0,13201.0,issue tracking gem release dbm,5481.0,beginrnrnuptodate summary propo,relates,1.0,
784.0,1834.0,4632.0,beginnregexpunion great feature,15914.0,would nice able use mkmf,independent,0.0,
875.0,7162.0,12985.0,need implement rfccompliant cookie hand,15580.0,hellornrni sure whether propo,independent,0.0,
292.0,350.0,12968.0,kernel provides global conversion functi,12732.0,would like able pas option,relates,1.0,
202.0,913.0,6697.0,consistency seems make sense add,14329.0,abstractrnrnspeedup blockcall,independent,0.0,
17.0,645.0,8848.0,commit yui naruse added stringb,10391.0,occasionally need use string l,relates,1.0,
678.0,77.0,13488.0,currently encodingdefault external set,16604.0,issue related,relates,1.0,
1547.0,432.0,12222.0,python statistic library calculati,12217.0,issue propose introduce enumerabl,relates,1.0,
1328.0,6280.0,10107.0,reduces casting long line sho,15947.0,env basically hash like methodsrnso w,independent,0.0,
1083.0,643.0,8897.0,propose ruby support client side tcp f,8871.0,propose ruby support server side tcp fa,relates,1.0,
702.0,7489.0,17296.0,rnrnthe fileutilschmod provides sam,10468.0,parserrb initialize,independent,0.0,
1240.0,140.0,15958.0,matz changed timeto format fr,16470.0,ruby added nanosecond representation th,relates,1.0,
670.0,5921.0,16739.0,often see code like followingrnrn,13697.0,assigning kosaki since wrote current,independent,0.0,
290.0,554.0,5220.0,noticed nilclassto accept,16350.0,im sure bug feature,independent,0.0,
61.0,503.0,15093.0,currently ruby head following giv,3399.0,beginrn gdbrn,independent,0.0,
1439.0,260.0,14133.0,module class reopened change,14132.0,module class reopened change,relates,1.0,
645.0,7290.0,7614.0,beginrnprior issue reminded ive,15217.0,allows u perthread default,independent,0.0,
609.0,861.0,5690.0,would great way dynami,5666.0,would like make rb public ap,relates,1.0,
14.0,6179.0,14781.0,alternative proposal objectenumer,11170.0,patch variablec extract common funct,independent,0.0,
1276.0,7045.0,14462.0,whether mjit enabled probably b,13504.0,originally added warning module,independent,0.0,
815.0,871.0,5549.0,request following methodsrnrn com,4574.0,beginrnhellornrnmany people writt,relates,1.0,
562.0,7743.0,9303.0,write unit test fileutilsc,10773.0,see codernrnrnmodule mrn modul,independent,0.0,
1274.0,269.0,3714.0,beginrn given enumerator wa,14044.0,described numonarray pycal,relates,1.0,
1414.0,1165.0,15571.0,proposalrnthe rubygem root provides,15899.0,seems method getting su,independent,0.0,
1152.0,667.0,8579.0,id like propose new type string liter,8923.0,related feature already f,relates,1.0,
648.0,7572.0,10423.0,patch also downloadable,5248.0,beginrnhellowrnrni wrote patch,independent,0.0,
696.0,4935.0,15797.0,one reason simplicity,8506.0,beginrnrubys enumerator enum,independent,0.0,
1258.0,402.0,12512.0,think value transformation fundamental,8951.0,please see thread,relates,1.0,
850.0,3196.0,7580.0,beginrni would like propose,11575.0,im sure problem erb bu,independent,0.0,
1039.0,1103.0,5707.0,tempfile always us finalizer delegater,14783.0,wanted extract character certain,independent,0.0,
1204.0,2721.0,10683.0,find way global function hash aka,11375.0,pathnamerb many string literal,independent,0.0,
1423.0,4802.0,14383.0,running old code ruby,9450.0,ruby team hashing future,independent,0.0,
908.0,299.0,13600.0,one main use case would make yie,6284.0,would nice able compose procs l,relates,1.0,
75.0,367.0,14055.0,following string symbol method cu,12786.0,descriptionrnrni would find stringcasecmp,relates,1.0,
269.0,712.0,7854.0,propose new class method symbol,7839.0,hirnrnon team rail trouble,relates,1.0,
1271.0,417.0,12319.0,moduleconst get accepts nonnested string,5690.0,would great way dynami,relates,1.0,
735.0,1341.0,16559.0,hellornrnthere appears bug net,15074.0,currently working ruby api basically,independent,0.0,
1227.0,4400.0,16670.0,currently syntax pattern matchi,3282.0,beginn currently running debugg,independent,0.0,
488.0,1114.0,13001.0,would like include none slot,7414.0,class foornendrnobjectconst get object,independent,0.0,
1030.0,0.0,15743.0,understanding rubyvm supposed,17500.0,rubyvm traprn user think,relates,1.0,
1382.0,5149.0,10087.0,change add new target cpu structur,17279.0,rangestep prohibits negative step,independent,0.0,
665.0,1270.0,4447.0,beginnplease add stringbyteslice method,12093.0,implementing feature boost template e,independent,0.0,
164.0,978.0,4257.0,beginn switch hittered already passed nearl,4068.0,beginn current standard date library,relates,1.0,
465.0,976.0,4073.0,beginn suspect ruby mi,1784.0,beginn glad see there build,relates,1.0,
173.0,286.0,13807.0,frequently see code us value,15557.0,often see code like thisrnrn rubyr,relates,1.0,
1420.0,7098.0,11241.0,look like extension structs bu,7702.0,beginrnas discussed recent ruby,independent,0.0,
452.0,274.0,14022.0,joining element array,15024.0,think could handy block suppor,relates,1.0,
1064.0,864.0,4151.0,beginrn hirn rn method,5662.0,ruby often use idiom build,relates,1.0,
1092.0,3859.0,13587.0,patch add preallocation string,4979.0,beginrnrnwhen foorb fo,independent,0.0,
1181.0,7599.0,12083.0,think bindinglocal variable get bind,15955.0,id love way apply unboundmethod,independent,0.0,
752.0,415.0,12334.0,sort relates,12021.0,final instance variable ruby,relates,1.0,
336.0,839.0,13849.0,current help show help dum,12354.0,step reproducernrncreate ec keyrn,independent,0.0,
1085.0,5668.0,17418.0,since main ractor special seems useful,10343.0,case statement condition part n,independent,0.0,
184.0,1667.0,16637.0,term like strftime strptime,14278.0,opensslhmacdigest show unclear,independent,0.0,
200.0,155.0,14392.0,would like see implemented ruby pipe,15799.0,implemented pipeline operator topi,relates,1.0,
9.0,3068.0,8190.0,begin rn,6210.0,load currently take optional second argume,independent,0.0,
742.0,2454.0,7849.0,even though symbol technically hon,15605.0,release json gem,independent,0.0,
493.0,6713.0,10119.0,add changedsince fetch modifierrn,11554.0,improve consistency moduledefine met,independent,0.0,
386.0,621.0,13884.0,often array used filter paramete,11911.0,one ruby biggest strength ability,independent,0.0,
720.0,934.0,13694.0,today june tau day honor,4897.0,firstly please read tau manifesto,relates,1.0,
1494.0,2041.0,16667.0,allow parameter symbolto proc method,12931.0,many people would probably like use bindin,independent,0.0,
251.0,571.0,16260.0,seems symbolto proc return proc tha,6503.0,openssl added support next protocol,independent,0.0,
1433.0,943.0,4698.0,ruby licensing ruby,2000.0,beginn hellorn rn recently readline,relates,1.0,
1267.0,970.0,7241.0,often use inject method build,4151.0,beginrn hirn rn method,relates,1.0,
253.0,3663.0,11749.0,variablec remove spurious define global,14932.0,sure exactly pull,independent,0.0,
27.0,4158.0,8016.0,beginrnall previous issue discussin,16773.0,minor patch help reduce alloca,independent,0.0,
800.0,1242.0,16827.0,want write custom random number generator,12752.0,parsed binary protocol msgpack,independent,0.0,
150.0,4297.0,6507.0,beginrnone feature rebol pro,12967.0,stand ruby heap grow rate,independent,0.0,
432.0,630.0,11473.0,matz said string literal immutable,8976.0,yesterday facetoface developer mee,relates,1.0,
348.0,6935.0,14777.0,hirnrnas mentioned,16372.0,tried code got sytax errorrnr,independent,0.0,
895.0,440.0,12447.0,sometimes want extract digit placeva,12116.0,sometimes need apply divmod repeatedly,relates,1.0,
1390.0,868.0,5607.0,beginrnwhen tried access excel file,2323.0,beginrn surfboard e,relates,1.0,
535.0,911.0,5064.0,currently problem netht,5461.0,beginrnthe attached patch add pip,relates,1.0,
1061.0,906.0,5112.0,first working inadvertent sy,5072.0,recently discovered denial service vuln,relates,1.0,
622.0,747.0,7340.0,following discussion,6687.0,beginrnlet propose enumerablewith,relates,1.0,
302.0,31.0,17134.0,add resolve timeout tcpsocketnewrnit,17187.0,add connect timeout tcpsocketnew sa,relates,1.0,
54.0,1073.0,17473.0,pathname one useful utility class,16102.0,since symbol proc method n,independent,0.0,
43.0,311.0,13395.0,seem method ruby,12075.0,sometimes write following codernrnru,relates,1.0,
987.0,6157.0,7849.0,even though symbol technically hon,11788.0,abstractrnrni wrote new rubyvminstru,independent,0.0,
208.0,1016.0,2509.0,beginrn like freezing constant confi,17145.0,id like propose objectdeep freezern,relates,1.0,
1201.0,186.0,15236.0,pr github,15286.0,suggestion hash shorthandrn,relates,1.0,
835.0,230.0,13241.0,currently exploratory proposalr,14618.0,abstractrnrnunicode display width,relates,1.0,
843.0,2948.0,3021.0,beginn arraypermutation combination wi,15571.0,proposalrnthe rubygem root provides,independent,0.0,
781.0,541.0,11049.0,sometime want grep like operation,5588.0,please add negation flag regexps whic,relates,1.0,
761.0,349.0,12973.0,require relative speed loading file,8781.0,wrote attached small script rrcrb stand,relates,1.0,
1536.0,816.0,6737.0,generally speaking nice,6442.0,ruby hash class internally conn,relates,1.0,
476.0,1164.0,7288.0,documentation chmods uppercase featu,17018.0,rb profile frame backend,independent,0.0,
408.0,657.0,8658.0,adding new method processclock g,8096.0,beginrna lot scenario application,relates,1.0,
258.0,800.0,6636.0,made clear enumerab,3715.0,beginrn would useful able,relates,1.0,
92.0,6049.0,16838.0,ruby enumeratorrnrn ru,14585.0,abstractrnrni propose add method,independent,0.0,
239.0,305.0,13563.0,hirnrni propose hashchoice methodrnr,8499.0,according experience following two,relates,1.0,
264.0,663.0,12173.0,frequent time instancer,8640.0,hirnrnwe time many thing rail,relates,1.0,
1153.0,6791.0,10571.0,kind curiosity far searched,5779.0,hellornrnthe ftp documentation ruby,independent,0.0,
1017.0,1346.0,12318.0,often achieve element using iterator w,4145.0,beginn cworkirbrn,independent,0.0,
479.0,7554.0,4016.0,beginn please consider adding age unicod,17479.0,backgroundrnrnthere currently way,independent,0.0,
916.0,3142.0,10503.0,currently argumenterror raised uri,9565.0,argument method form constcla,independent,0.0,
307.0,7678.0,17546.0,riscv architecture getting mo,15605.0,release json gem,independent,0.0,
890.0,669.0,8579.0,id like propose new type string liter,8909.0,suffix declare frozen string,relates,1.0,
1522.0,4760.0,17177.0,many debugging situation want inspe,14669.0,project needed know many captu,independent,0.0,
1050.0,571.0,10552.0,counting many time value appears som,10228.0,im gonna implement feature related,relates,1.0,
434.0,2293.0,13368.0,declaration local variable loop,9853.0,hirnrnin ruby thisrnrnw,independent,0.0,
1462.0,189.0,15230.0,id like feature know loaded,15903.0,rubyvm contains mostly mrispecific feature b,relates,1.0,
748.0,2473.0,4805.0,openssl return dif,9390.0,alpn successor npn support fo,independent,0.0,
1348.0,483.0,11741.0,git svnrnrnconverting ruby wholesale,14551.0,know migrating git get asked least eve,relates,1.0,
989.0,708.0,7895.0,threadbacktrace location kernelcaller l,8960.0,party agreed would useful add,relates,1.0,
684.0,112.0,1873.0,beginrn suspect matchdatasymbol,8912.0,beginrnwhen custom exception clas,independent,0.0,
1262.0,245.0,10880.0,often happens want use method f,11300.0,proposalrnrnit proposed string,independent,0.0,
1210.0,32.0,16752.0,defining private constant require,17171.0,rubyrnclass foorn def call mern,relates,1.0,
806.0,822.0,6309.0,interesting us weakref much hard,6308.0,weakrefs delegation feature really awf,relates,1.0,
1316.0,245.0,8158.0,use lightweight structure loaded feature,14460.0,hirnrnive attached patch speed u,relates,1.0,
1041.0,520.0,13969.0,dir class method pair direntries,11302.0,direntries return array content wi,relates,1.0,
1311.0,745.0,7340.0,following discussion,7384.0,propose object renamed,relates,1.0,
485.0,805.0,8846.0,propose changing moduleinclude public,6539.0,feel inconsistency meth,relates,1.0,
1478.0,5572.0,9799.0,current behavior either n,5650.0,currently rb raise raise exception,independent,0.0,
1166.0,507.0,11210.0,string omit subnet mask,11527.0,right there way get current va,relates,1.0,
1122.0,587.0,10867.0,case rb atomic type retrieved,17156.0,one main use case refinement,independent,0.0,
430.0,193.0,14187.0,currently mri many test suite bootstr,16244.0,comparing time using pretty,independent,0.0,
20.0,3639.0,11629.0,list exception raised netsm,11664.0,rb autoload value may safer preventing,independent,0.0,
731.0,268.0,1349.0,beginn open message send message met,16663.0,many library use caller,independent,0.0,
1381.0,443.0,12086.0,currently refinement activated,12281.0,ruby refinement could used,relates,1.0,
953.0,5385.0,5281.0,fhs system might beneficial allo,11170.0,patch variablec extract common funct,independent,0.0,
548.0,49.0,16989.0,opening series feature request,16994.0,would like shorthand syntax frozen se,relates,1.0,
846.0,532.0,11105.0,support hash literal,11104.0,support hash literal,relates,1.0,
1521.0,141.0,14912.0,propose new pattern matching syntaxrnrn,15918.0,currently set respond deconstr,relates,1.0,
504.0,2157.0,14140.0,already branching error logging format f,14315.0,rnzlib reduce garbage gzip writes de,independent,0.0,
394.0,442.0,14656.0,without development tool trying insta,10740.0,spec becaus,independent,0.0,
660.0,651.0,8777.0,hirnrnthis related mach ab,8658.0,adding new method processclock g,relates,1.0,
1516.0,7314.0,6251.0,currently compile option set rubyv,11624.0,problemrnrn erb dsl commentin,independent,0.0,
1002.0,404.0,12512.0,think value transformation fundamental,9970.0,method simplify two common pattern whe,relates,1.0,
753.0,838.0,6163.0,beginrnthe syck extension removed,2340.0,beginn yaml syck why product,relates,1.0,
727.0,512.0,11420.0,let introduce id key table optimization,9638.0,allow better use cachefriendly,relates,1.0,
85.0,640.0,8921.0,would handy select could accept r,11049.0,sometime want grep like operation,relates,1.0,
568.0,559.0,10552.0,counting many time value appears som,10228.0,im gonna implement feature related,relates,1.0,
220.0,7730.0,6070.0,hirnrnin ruby scope loop va,2347.0,beginn easy get infinity ruby,independent,0.0,
603.0,654.0,8693.0,def yield end def,15973.0,kernellambda receives proc,relates,1.0,
644.0,6020.0,14767.0,gcc use monotonic counter objspace mall,12744.0,patch add strreverse strre,independent,0.0,
1495.0,795.0,7292.0,official method expl,6669.0,given hash hmap return arrayali,relates,1.0,
999.0,5458.0,5479.0,currently lot apis accept string,5630.0,netftp support binary text transfer mod,independent,0.0,
1425.0,282.0,12010.0,direach dirread including direntr,13969.0,dir class method pair direntries,relates,1.0,
276.0,789.0,7384.0,propose object renamed,6687.0,beginrnlet propose enumerablewith,relates,1.0,
5.0,3843.0,14724.0,mathematics chain inequations shor,14033.0,ruby introduces arrayappend alias,independent,0.0,
897.0,479.0,11951.0,rubyvminstructionsequencecompile rai,11868.0,currently rubyvminstructionsequencecompile,relates,1.0,
428.0,377.0,12739.0,class object deprecate constant f,12005.0,cruby two integer class fixnum,relates,1.0,
721.0,88.0,12086.0,currently refinement activated,16461.0,overviewrni propose procusing support,relates,1.0,
109.0,127.0,16038.0,know objectspaceweakmap isnt really sup,16471.0,id like request two feature weakref,relates,1.0,
1024.0,619.0,2348.0,beginrn merit library bee,9121.0,rbtree slower pure ruby versionr,relates,1.0,
809.0,791.0,6721.0,rni think following method missing fr,6684.0,beginrnobjectdornthis first post,relates,1.0,
161.0,6215.0,9590.0,rnhellornrni think ill introduce st fo,10445.0,ive made patch matrix return new,independent,0.0,
516.0,928.0,6298.0,beginrnmaybe another way thi,5007.0,im proposing method called proccall,relates,1.0,
308.0,500.0,9453.0,ruby returning symbol def,11541.0,since ruby def return symbol th,relates,1.0,
643.0,675.0,8556.0,propose adding mutexeddelegator simpl,8961.0,beginrni propose synchronizable mixin,relates,1.0,
1545.0,3699.0,12211.0,proposes new method datefirst month,16833.0,surprising enumerator somet,independent,0.0,
1112.0,300.0,13588.0,implementing iolike object id like,11094.0,originally defined codespace,relates,1.0,
393.0,859.0,12319.0,moduleconst get accepts nonnested string,5690.0,would great way dynami,relates,1.0,
1213.0,670.0,8579.0,id like propose new type string liter,8976.0,yesterday facetoface developer mee,relates,1.0,
1563.0,143.0,15752.0,believe introduce module exp,15903.0,rubyvm contains mostly mrispecific feature b,relates,1.0,
51.0,4571.0,7299.0,ruby completely ignore blocksrn,12017.0,seems reasonable application load,independent,0.0,
1474.0,294.0,13694.0,today june tau day honor,4897.0,firstly please read tau manifesto,relates,1.0,
710.0,652.0,8771.0,beginrn start fake proxy separate w,6546.0,nahi suggested request o environment h,relates,1.0,
638.0,578.0,12010.0,direach dirread including direntr,10121.0,irc someone asked find dire,relates,1.0,
1531.0,760.0,7022.0,would useful profilers,2565.0,beginrn hirn rn made commit e,relates,1.0,
494.0,501.0,11541.0,since ruby def return symbol th,13560.0,hirnrnim suggesting moduleattr,relates,1.0,
129.0,1698.0,10740.0,spec becaus,5610.0,unix system often debug user,independent,0.0,
1332.0,2205.0,7596.0,beginrnthe current implementation fin,11749.0,variablec remove spurious define global,independent,0.0,
1491.0,87.0,16463.0,ruby outrnit aim warn ever,16897.0,rubyrnrequire benchmarkipsrnrnmodu,relates,1.0,
584.0,80.0,16463.0,ruby outrnit aim warn ever,16511.0,alternative id lik,relates,1.0,
1412.0,799.0,14225.0,since working deprecating removi,5198.0,pop smtp function like w,independent,0.0,
1305.0,2704.0,10331.0,current behavior stringto rec,16985.0,could improve pp hash string,independent,0.0,
871.0,25.0,17273.0,proposal introduce shareable con,17274.0,ticket describes semantics sharea,relates,1.0,
552.0,3532.0,16688.0,often work pathname object p,4481.0,beginrnplease add client ca method ope,independent,0.0,
563.0,604.0,12737.0,provide moduledefined refinement,9704.0,refinement remain filescoped,relates,1.0,
23.0,5593.0,4504.0,beginnrb fails pas block rb,12161.0,bigdecimals inspect humanfriend,independent,0.0,
840.0,1688.0,3023.0,beginn currently rdoc generates url met,9851.0,removed testunit minitest,independent,0.0,
46.0,194.0,12820.0,hellornrnthe patternrnrnrubyrnc,15192.0,motivationrnrnintroduce new syntax,relates,1.0,
732.0,7096.0,15302.0,procby allows currying implicitlyrn,9779.0,class link subclass,independent,0.0,
858.0,609.0,9508.0,since coverage extension introduced,13901.0,plan add branch coverage method c,relates,1.0,
380.0,362.0,12820.0,hellornrnthe patternrnrnrubyrnc,15192.0,motivationrnrnintroduce new syntax,relates,1.0,
242.0,4780.0,12352.0,matz showed rubyconf fol,6261.0,inspired ruby enumerablechun,independent,0.0,
1556.0,2832.0,14813.0,gcc make gc entergc exit pair dtrace probe,6497.0,added support completely disabling clien,independent,0.0,
666.0,3877.0,16779.0,would great format option qu,3953.0,beginrn noticed tcpsocketudpsocket,independent,0.0,
697.0,243.0,14489.0,currently discourse boot notice min,14492.0,rn rubygem like yomikomu,relates,1.0,
80.0,35.0,17100.0,ractor proposal new concurrent abst,17145.0,id like propose objectdeep freezern,relates,1.0,
278.0,271.0,14042.0,hi rnrnive attached patch make iop,9323.0,propose addition iowritevrnit enables,relates,1.0,
718.0,3977.0,5448.0,hi rnrnclasses mixing single,6286.0,would nice exception class could e,independent,0.0,
1463.0,5300.0,3085.0,beginn due precision timestamp tha,11818.0,request hashcompact hashcompact,independent,0.0,
725.0,285.0,13847.0,try use default gem fix,10320.0,requiring library global namespace alw,relates,1.0,
962.0,1067.0,15239.0,current spec test use th,15172.0,backgroundrnrnthis proposal emanates f,independent,0.0,
1554.0,4314.0,12244.0,sometimes calculates integer integer n,10634.0,add method benchmarkreportbaseline,independent,0.0,
496.0,1256.0,4778.0,manipulating text file mostly inpu,9650.0,hi guy rnrna quick idea next maj,independent,0.0,
1090.0,3276.0,15829.0,id like propose sugar objectthen,12354.0,step reproducernrncreate ec keyrn,independent,0.0,
282.0,134.0,12957.0,currently create lambda proc one u,15973.0,kernellambda receives proc,relates,1.0,
990.0,6023.0,7349.0,inheriting directly structnew clas,4234.0,beginrn initial value hash defau,independent,0.0,
345.0,3083.0,10083.0,hirnrntheres issuernrnrubyr,15777.0,zeitwerk need able check given,independent,0.0,
289.0,381.0,12697.0,method like alias method attr accessor defi,8846.0,propose changing moduleinclude public,relates,1.0,
194.0,1032.0,4698.0,ruby licensing ruby,2000.0,beginn hellorn rn recently readline,relates,1.0,
1302.0,2822.0,16374.0,adding new method object clas,8636.0,discussed whether rdoc documentation,independent,0.0,
1421.0,523.0,14197.0,none one accept,11286.0,proposalrnit proposed enumerable,relates,1.0,
1552.0,338.0,13137.0,update javascript added object shor,11105.0,support hash literal,relates,1.0,
1539.0,3479.0,9916.0,bit big attach proposal basi,7978.0,beginrnthe current behavior followin,independent,0.0,
25.0,1027.0,10084.0,unicode string normalization frequent ope,2034.0,beginrn consideration recently giv,relates,1.0,
495.0,105.0,16018.0,since moduledeprecate consta,16345.0,propose ruby doesnt emit deprecation,relates,1.0,
1451.0,81.0,10637.0,encountered issue bringing v,16482.0,right nethttp force user use cl,relates,1.0,
63.0,958.0,5543.0,first rb thread blocking region requires th,4328.0,beginrn think general enough rem,relates,1.0,
57.0,6009.0,10123.0,broken using rnrnrn echo,10183.0,method class special alway,independent,0.0,
711.0,4123.0,17393.0,could helpful define ractormovedi,3185.0,beginn fileexpand path passed str,independent,0.0,
30.0,4430.0,15010.0,currently multiple array allocated,5590.0,begin pgp signed messagern hash,independent,0.0,
561.0,6718.0,10107.0,reduces casting long line sho,16851.0,implemented linear probing simple,independent,0.0,
821.0,427.0,12241.0,refinement feature,16746.0,ruby syntax full end im paranoid,relates,1.0,
773.0,1580.0,9023.0,propose addition tail method,10052.0,implementation queue sizedqueue ha,independent,0.0,
616.0,949.0,5044.0,reason zip doesnt return r,4539.0,inspired haskells zipwith function ha,relates,1.0,
904.0,3938.0,17339.0,abstractrnthousands million,3246.0,beginn hirn rn currently yamlyamler,independent,0.0,
1385.0,1537.0,7846.0,id like disable tl compression tl,7918.0,currently ruby library way detect,independent,0.0,
932.0,2778.0,6724.0,gimme gimme gimme waaaaaant dont need,15567.0,situation rescue except,independent,0.0,
828.0,3769.0,2617.0,beginn patch level irbmain,4309.0,beginrn hi allrn rn recently noticed,independent,0.0,
250.0,1684.0,2456.0,beginrn example module th,10251.0,current implementation urifind proxy w,independent,0.0,
705.0,258.0,14138.0,many good reason simply define,14240.0,think four special variable separat,relates,1.0,
869.0,4684.0,7702.0,beginrnas discussed recent ruby,4688.0,documented functionslast functionscount,independent,0.0,
783.0,1772.0,9405.0,think one pro,13333.0,currently block take block bl,independent,0.0,
1418.0,806.0,12697.0,method like alias method attr accessor defi,6539.0,feel inconsistency meth,relates,1.0,
128.0,216.0,13685.0,unicode published week ago,14802.0,unicode version published somet,relates,1.0,
76.0,6025.0,11081.0,case process encounter highnumbered fds,14092.0,dont work tempfile often every ti,independent,0.0,
1010.0,5776.0,5145.0,currently arraytranspose doesnt transpose,7257.0,eric hodel planning update rubygems,independent,0.0,
189.0,875.0,5481.0,beginrnrnuptodate summary propo,11057.0,gemified json libraryrnrn,relates,1.0,
77.0,439.0,12116.0,sometimes need apply divmod repeatedly,4787.0,suggest new feature integer enumerat,relates,1.0,
1380.0,865.0,5653.0,hirn rntoday talked nahi en,7835.0,ago matz declared intention rem,relates,1.0,
101.0,162.0,15751.0,similar nameerrorreceiver return,16419.0,exception class receiver accept r,relates,1.0,
649.0,4533.0,15170.0,currently nice way give webrick,15974.0,there really common mistake people make wh,independent,0.0,
