req1,req2,id1,id2,Label
hi \r\n\r\nbecause to add javascript file in,hi \r\n\r\nit will be great adding condition,47857,38176,1
sometimes newly installed extensions break the,if the install tool could check whether the in,49301,49760,1
as the expall menu property is now going throu,problem currently expall lacks stdwrap proper,20445,19685,1
gather all ces which are not assigned to val,imagine the following scenario crea,67884,76564,1
that would be great to have an install tool wi,we now have the update wizard in the install,,,0
it would be nice if could check wheth,the attached patch implements autoloading for,16385,19503,0
the nonrelationtables and nonrelationfields,the patch,79387,65461,1
hunspell is an os spell checker used in opeono,it would be nice if index search would autode,,,0
add new frontend editing extension that adds,wrote viewhelper for fe edit it would be,,,0
we have few functions to deal with ip addres,feature add anonymizing capabilities to the,25336,25404,1
the workspace selector is currently using lo,problem \r\nthe current workspace selector is,19474,19628,0
hi team \r\n\r\nno pagination available on htt,hi \r\n\r\nthe current system to browse record,,,0
doc core tsconfig tells us the syntax is as,tsconfig per content tt content is needed in,,,0
think it is too much boiler plate to registe,registering plugins based on tt conent became,65265,48538,1
allow to remove height and width information,result of the workshop implementing reponsiv,51842,50075,1
first of all must to say your dce extension,the bodytext property could be used on save,36924,36272,0
currently it not possible to search for loca,for multi language sites it is not really conv,89524,46017,1
it should be possible to configure the pageren,should be great to be able to declare head,60723,11287,1
in some cases it may be necessary to have an,div geturl is know to be hudge and,28839,28344,1
as developer for viewhelpers would like to,the tagbuilder should allow access to the attr,30555,37460,1
actually ajax is used for hide/unhide or delet,just usability suggestion which would correc,78931,75462,1
to enhanced the security change install tool,as we have an rsaauth library now and servic,,,0
it would be very usefull if the form objects,if you need compact formular one possible wa,63391,53406,1
stores date and date/time values as un,since has been committed to core dbal,38965,38974,0
the video tag has the possibility to add,hallo \r\ni have created patch for media con,,,0
the additionalparams behaviour should be als,with the rte htmlarea link popup doing an,,,0
with the rewrite of the module be user adminis,when upgrading to the function comp,,,0
dates have to be entered like this,the current date/datetime fields of core,,,0
only say parsefunc as not sure where thi,the rte configuraion or is this an issue for,,,0
when classes are extended inheritance should,objects yaml should allow for adding and ove,37372,37373,1
sometimes we need to have file mount eg al,hi \r\nit would be very useful if one can defi,,,0
create toolbar that can be enabled to provid,think that should have debug toolbar,,,0
hi guys \r\n\r\nespecially when developing app,this could be considered as discussion and,54155,33487,0
extension dd googlesitemap,when documentation gets bigger it could be,45637,45827,0
it would be nice to have navigation titles for,when we switch the page type from standard,16749,22550,1
in some cases it may be necessary to have an,div geturl is know to be hudge and,28839,28344,1
certain caches are static once they ve been fi,update the caching framework to version,,,0
this is kind of follow up of ticket,sometimes it necessary to link to an explici,90825,22113,1
after being able to move and rename files cre,it would be useful to add drag and drop to the,57692,55193,1
have you ever consider to add \r\nexpand/colla,here is the diff that creates same functionali,,,0
often when you want to store different kinds,if be user opens page with doctype sysfold,51915,36705,1
youtube video urls in the media element are re,currently only swf is supported,,,0
the current implementation always adds new irr,if you have configured newrecordlinkposition,,,0
when set an attribute rel= nofollow to the,hey there \r\n\r\nis there solution for the,,,0
sometimes you want to let certain scheduler,currently manually executed tasks are run dire,,,0
stdwrap is not possible for select where \r\ne,by using markers and properly quoting and esca,17881,22338,1
the configuration of the rte has numerous prop,problem configuring the rte in page ts config,16484,28325,1
the result of an indexed search search shows,the search result has path with the pagetree,62718,82070,1
within cms it is not possible for th,this hook enables you to modify the hash base,56269,28299,1
for easier usage the behaviour should be norm,at the we get the feedback that hotke,57065,66343,1
if makes it to core here is the patch,it would be nice if db provides an api,,,0
if an extension that contains backend menu,when new backend module is installed it can,16920,15084,0
those urls get mangled rte and possibly part,it would be fine if editor can set in rtehtml,,,0
parsing of body arguments xml json cur,when building rest service that uses the pat,,,0
have an format case viewhelper with the op,it would be great to have case viewhelper in,,,0
hi \r\n\r\n brings nice functionality to,since is possible to use fluid for the,71343,79225,0
hello \r\n\r\nit would be really nice to have,in boolean viewhelper attributes like the i,40338,33394,0
noticed that only pages and language tab,tried to use the new way to handle restric,84493,84244,1
an image describes more than thousand words \r,an image describes more than thousand words \r,44039,44038,0
not bug but very simple feature request wi,hi \r\n\r\nplease add the serbian flag in the,,,0
imagine you ve two different and dynamically,refactor tslib gifbuilder calcoffset to be,20207,20199,1
it would really be nice to override the headi,it currently not possible to change the labe,16605,18931,0
it would really be nice to override the headi,it currently not possible to change the labe,16605,18931,0
the current implementation always adds new irr,the default behaviour of the inline tca input,,,0
it is sometimes necessary to know which user,clearing the whole page cache on large website,23315,23302,1
sometimes plugins felogin are in the same pa,if there are two login forms on page usecas,50138,34597,1
hi folks \r\nright at this point am thinking,the debugexceptionhandler and productionexcept,43247,43569,1
currently there exists no direct way using typ,in the release notes for in,45090,34403,0
the debug function at src,sometimes you wish to give control instruction,,,0
since palettes open inline this,currently the menu in the left frame uses pa,18072,17680,1
at the we get the feedback that hotke,it would be really nice to have keyboard co,66343,5390,1
distribution comes with an easy to use,m currently putting an package tog,,,0
we need mechanism which prevents the user fr,scenario \r\n\r\nthe developer programmed,2817,4960,1
sometimes you need to set multiple headers of,this patch adds stdwrap to config additionalhe,56236,23494,0
currently the menu in the left frame uses pa,to move ui elements around in the be ui it is,,,0
currently there is only postprocessor to do,there are no options to set subject for the,44482,38094,0
because there are some plugins enabled to let,this patch request contains functions for,,,0
as from the news from the gnu aspell project,it would be nice if index search would autode,49282,57928,1
the noopener link type prevents an opened ur,hey there \r\n\r\nis there solution for the,82055,78488,0
like to give some be users the possibility,for each record in the databse the list module,,,0
since the implementation of custom error rende,this is backport from flow described an,,,0
utility method should be added to dynamicall,browser for references stored in any documen,51756,51280,1
when the slug changes for example because one,situation \r\n\r\n did fresh install,86495,86937,1
hi \r\n\r\nit would be great if we add an opti,similar to mod web list enableclipboard the,63805,63496,0
introduced the new responsive images whe,it seems fluid styled content does not support,57417,70965,1
currently cms has no easy/working way fo,think should be the default output for,61799,49547,1
add checkboxes to each user and make new co,enhance tools user admin so that user groups,16314,16313,1
what is your opinion about introducing,extracted from issue,39441,50131,1
pre \r\nimported from,at the we get the feedback that hotke,92432,66343,0
currently the installtool is only in english,currently many messages feedback / error are,87091,87092,1
currently the svg content object renders svg,add support to reference file wirh ext syntax,,,0
in the info module pagetree overview the,the info module has currently hardcoded sele,34541,83449,1
afaik at the moment you need userfunc to,by using markers and properly quoting and esca,21169,22338,0
when resource object is discarded the relat,the mvc framework needs to support file / mult,6008,342,1
currently page of type shortcut can only,when you want to have page in menu which is,,,0
since compilation of ext sphinx manual,the reference browser already lets the editor,,,0
update the caching framework to version,the tagging features of the file backend are,39430,36564,1
typoscript option subjectfield wrap would be,it would be nice to make something like this,54030,68771,1
patch attached it uses the same extension as,add flags for all languages supported by,6969,49108,1
would be great to enable the access of arrays,m not exactly sure if this is bug or mis,,,0
it would be very usefull if the form objects,the extension tx form should allow using the,63391,61308,1
subject says it all,hello \r\n\r\ni think there should be some sor,45633,51432,1
this hook enables you to modify the hash base,within cms it is not possible for th,,,0
requirements and ideas for autoloading in typo,problem \r\ncaching is way to speed up rende,19192,19180,1
we need concept for cacheable viewhelpers,it would be nice to have have way to tell fl,,,0
hi \r\n\r\nwhen you add section and into it,it would be nice if it could have section in,64555,60034,1
this is kind of follow up of ticket,it might be useful to set the target language,,,0
the title says all which is to say\n\n\n\nthe,selicons are missing for the flag selector box,23519,24813,1
this patch add unicode detection for oracle da,thish is patch to begin adding oracle suppor,79900,79899,1
hi \r\n\r\nplease add the serbian flag in the,in are no flags for turkey an,20709,19093,1
since the implementation of it is poss,it would be useful to let people register thei,50811,49129,1
this is kind of follow up of ticket,sometimes it necessary to link to an explici,90825,22113,1
pre code class= xml config \r\n type inp,to handle the parameter strings which are gene,40110,40111,1
in the old extension manager it was possible,the new documentation module provides signal,49090,50003,0
in relation to feature which is currentl,included css and js files is cached by the bro,22387,22376,1
the patch,the patch,65460,65461,1
usually when upgrading from one version,we need concept and implementation for flush,,,0
in the original concept for the new page tree\,use case \r\n\r\nit is possible to filter,36075,92576,1
it would be nice if it would be possible to re,introduced the new responsive images whe,48090,57417,1
this ticket is similar to my previous,problem \r\nafter switching to there are,,,0
using the clipboard to other than normal,situation \r\nlist view only one specific rec,26139,40690,1
the current date/datetime fields of core,dates have to be entered like this,15017,14390,1
it would be nice to have message field in th,we have lot of customers who are migrating,,,0
in indexed search/pi/class tx indexedsearch ph,when displaying search results slash is hard–,33556,23156,1
adding placeholder attribute to the formengi,if you need compact formular one possible wa,71112,53406,0
the record history needs correlation id to,with new feature for correlation ids,,,0
the linkvalidator default pagetsconfig curre,we repeatedly have errors in the log due to in,89177,92542,1
list view should have collapse / expand fu,have you ever consider to add \r\nexpand/colla,19808,15818,0
currently the resolution of view class and,currently fluid throws nice exception when,,,0
does not generate sprites on its own,there is no sprite generator shipped with typo,23151,23150,1
fluid does not provide way to access flexfor,the tca allows the field flex want use some,89509,92875,1
if the install tool could check whether the in,sometimes newly installed extensions break the,,,0
currently ships with now requires,core currently ships \r\n\r\nfor compati,37921,48223,1
such data processor could be used to fetch,maybe just as content objects that write fla,68420,64723,1
add fallback for servers without mod rewrite /,should check somehow if mod rewrite is,,,0
use case is as follows \r\n\r\n document is,it would be really cool to override cross link,,,0
if you install new you ll get no page,currently after successful install of,29737,38731,1
to modify or evaluate the returned values for,in some proy environments is only the environm,,,0
my suggestion for,is repeatedly referred to as enterpric,72049,71697,1
the path to the php binary should be configura,distribution comes with an easy to use,6681,4426,1
starting from and expanding that idea,suggesting typoscript parameter for hmenu sp,19629,17747,1
would be cool to have pagetsconfig for backe,it would be really helpful to be able to defin,,,0
since core extensions sysexts are stable and,when looking in the em for my installed extens,83463,70157,1
write tutorial about how to use the new temp,the current marker templating system collected,,,0
gifbuilder lacks of the possibility to define,refactor tslib gifbuilder calcoffset to be,20164,20199,1
if you use pages with language overlays the pa,for multi language sites it is not really conv,,,0
add hook signal or configuration options th,would like to provide different image crop,72619,72620,1
in flow we have now lazy dependency,pre code \r\n php\r\nnamespace test \r\n\r\,48960,43819,1
if you have an image relation field defined in,the current implementation always adds new irr,78532,24019,1
currently cms has no easy/working way fo,youtube video urls in the media element are re,61799,53421,1
add an api method\r\n\r\n template addtcareco,add an api method\r\n\r\n template addrecords,,,0
in order to allow powerful processing for flui,sometimes it is needed or can be very helpful,67658,66907,1
in boolean viewhelper attributes like the i,currently the eel parser regex doesn recogn,,,0
hi there\r\n\r\nit would be nice to be able to,hello \r\n\r\nin repository will sort the,32051,79054,1
allow class for flexform sheet tabs in backend,there should be possibility to have at least,66589,75266,1
it would be really cool to override cross link,use case is as follows \r\n\r\n document is,48829,51875,1
it should be possible to define additional val,similar to there should be way to decl,,,0
tested cur for shotcuts put the front pag,tested cur for shotcuts put the front pag,14768,14769,0
make use of the symfony/process component to,hey \r\n\r\ni love to pipe the stdout of my,,,0
to be able to use ext form just as it is js,currently the submitted data of the form is on,83672,31094,1
stylesheets parsing code is not well structure,to get this dropdownbox for the css styles in,,,0
currently the flow developer has to set sess,it would be nice having proof cookie authent,56744,30378,1
have one tree installation with two langua,use cases are \r\n\r\n kriss toff,,,0
for multi language sites it is not really conv,hey guys \r\n\r\ni want to suggest new featu,46017,73665,1
as from the news from the gnu aspell project,hunspell is an os spell checker used in opeono,49282,19134,1
the system status update tests the cli environ,please add the feature to skip tests in the re,62101,52283,1
div geturl is know to be hudge and,after introducing we can,28344,28626,0
to move ui elements around in the be ui it is,currently the menu in the left frame uses pa,17678,17680,1
the em always shows developer relevant code wa,the extension manger shall not give always an,,,0
this is primarily intended to be used with,instead of evaluating google analytics code ri,62023,28382,1
we need new entity redirect in mvc/web/ro,when updating models property wich is used,,,0
since the implementation of custom error rende,this is backport from flow described an,,,0
m not exactly sure if this is bug or mis,would be great to enable the access of arrays,7203,6390,1
we need concept for cacheable viewhelpers,idea add new argument to the render viewh,3291,43457,1
image you drag drop many files in the fileli,the list module has great mass edit function,,,0
now finally the property mapper needs to suppo,it should be possible to submit date through,,,0
hi folks and core team \r\n\r\ni’m worki,see number in,,,0
propose to have method to register new,fluid and extbase are now ready to be included,,,0
sometimes you need to receive variable numb,following up on validation should make,3728,4146,1
currently many messages feedback / error are,they should be moved to one of standard langua,87092,17274,1
in are no flags for turkey an,hi \r\n\r\nplease add the serbian flag in the,,,0
launched discussion in the dev ml about in,following discussions on the dev mailing list,17771,17831,0
this patch allows to hide the checkboxes at th,introduces several page tsconfig settings to,17754,18879,0
during the first prototype of the so,would be cool to have pagetsconfig for backe,24060,37208,0
variants allow you to change properties of f,is known for its good multilanguage supp,,,0
since the implementation of it is poss,it would be useful to let people register thei,50811,49129,1
as part of implemented this idea \r\npa,when you lost your session you could change,,,0
the older implementation is fairly limited to,there is now use case for content negotiatio,37561,10680,1
requirements and ideas for autoloading in typo,in every class instances are done throug,,,0
the base of variant can be different for dif,variants for the site variant were added in,,,0
today there no possibility to get flow worki,d like new session implementation which\r\,,,0
this bug entry serves as an umbrella for sched,admin tools db check provides task to mana,25338,25339,1
integrate new workspace module based on extjs\,for the new workspaces module some functionali,23938,23942,1
is there any reason why function setheaders,it would be nice to see from where the web mai,20196,14389,1
actually ajax is used for hide/unhide or delet,just usability suggestion which would correc,78931,75462,1
the pagerenderer uses htmlspecialchars for the,most of the field outputted in head lack std,,,0
this bug entry serves as an umbrella for sched,admin tools db check provides task to mana,25338,25339,1
cms introduces usage of svg in icons,in issue suggested to have svg files,,,0
idea add new argument to the render viewh,we need concept for cacheable viewhelpers,,,0
the current accountfactory uses the generates,an implementation is already pending for,,,0
it is not possible to configure the language,the patch attached adds parameter preserveq,15175,15426,0
it should be possible to set identity and iden,if class schema exists and the type is set,6142,6140,1
allow fluid arrays only in viewhelper argument,see mailinglist thread about limitations in,43356,7608,1
would recommend to make some of the slug fie,allow the overwriting of the slug field via pa,,,0
implement proper http support \r\n\r\nthis,having framework that supports esi would giv,33371,37212,1
similar to the save and view page feature wh,in the configuration for the preview ur,81327,77581,0
because there are some plugins enabled to let,this patch request contains functions for,,,0
there will be lot of extensions in the,especially the list of all extensions does not,,,0
currently with fal there is no possibility to,iam talking about \r\n\r\n\r\nimages,66514,48644,1
for now under the page tree we have only opt,this is lacking feature that me and probably,15091,14442,1
it would be nice if it could have section in,hi \r\n\r\nwhen you add section and into it,,,0
to move ui elements around in the be ui it is,need to add the workspace selector to the clea,17678,17795,1
felogin decides what to display according to,request to have code list again in felogin,29565,38844,1
for multi language sites it is not really conv,currently it not possible to search for loca,,,0
if you are trying to build link in fluid,fluid parsing exceptions should contain the pa,37765,4704,1
when you select row of cells it would seem,the following would make life easier for autho,15537,18308,1
would like to see hook added for checking,more hooks are always useful \r\ni miss one,37800,64298,1
have added two new fields to fe users table,well know you can easily add this column by,23094,20530,1
when the slug changes for example because one,situation \r\n\r\n did fresh install,86495,86937,1
enhance tools user admin so that user groups,add checkboxes to each user and make new co,,,0
the field page config additionalheaders /i,this patch adds stdwrap to config additionalhe,21417,23494,0
creating new file reference in frontend cont,related to,90374,88833,1
we have multiple servers with multiple inst,it should be possible to assign testgroups or,27744,7365,0
as the taskcenter is done new the impexp exte,the taskcenter is redone completly to make it,22365,22363,1
hi \r\n\r\nfor cms reimplemented the,it would be nice if packages are bootstrapped,,,0
observed with cms loc,observed with cms loc,,,0
there will be site wide settings available th,in older versions it is possible to defi,,,0
hi \r\n\r\nonly one thought \r\n\r\na customer,the current implementation always adds new irr,83858,24019,1
it would be great if the html of the function,it would be great to move all html code from,19058,15524,0
versioning is part of the core but the ui is,it would be nice to hide the workspace menue,16365,16626,1
currently manually executed tasks are run dire,sometimes you want to let certain scheduler,45537,52686,1
if class schema exists and the type is set,it should be possible to set identity and iden,,,0
hi \r\n\r\nit would be great to think about us,hey \r\n\r\ni think that support for webp imag,92088,88537,0
remove extension name from function menu \r\ns,remove extension name from function menu \r\ns,33696,33695,0
hi \r\n\r\nthe current system to browse record,so im using now for few months and int,,,0
actually even with around you cant change the,this can be done by adding simple setter in,27115,29514,0
currently there is field to enter domainna,it quite some work to add like alternativ,36689,34342,1
currently it is not possible to override the,currently it is not possible to override the,20534,20533,0
backport openid sysext developed at hackontest,to improve single sign on services backport,,,0
currently there is only postprocessor to sen,currently there is only postprocessor to do,33914,44482,1
when using conditions in typoscript it is pos,normally you can only use = and for compar,16835,19515,1
as already mentioned the problem of false pos,this is one of several possible solution to ig,,,0
the base repository should provide some magic,it would be great if the base repository woul,2603,1676,0
currently provides command line interf,m currently putting an package tog,,,0
hi \r\n\r\nonly one thought \r\n\r\na customer,the current implementation always adds new irr,83858,24019,1
it is possible to output list of files from,fal file folders should contain an option to,67727,45725,0
aggregateroot annotation normative \r\n,use ddd semantics to add cascade attributes al,29037,29038,0
with the recent change to not trigger persista,because the flow framework follows rfc stand,51570,47951,1
currently it not possible to search for loca,hey guys \r\n\r\ni want to suggest new featu,89524,73665,1
if you use pages with language overlays the pa,for multi language sites it is not really conv,,,0
it would be great to add stdwrap functionality,would like to write\r\n\r\n alwaysactivepidl,16666,16665,1
please add possibility to deactivate an exte,problem \r\nremoving many extensions that cou,,,0
allow the overwriting of the slug field via pa,would recommend to make some of the slug fie,88322,89875,1
it possible somehow to add default value,as described in right now it not poss,,,0
hey guys \r\n\r\ni check all how many issues,the save and view button in the backend is onl,49972,23085,1
because there are some plugins enabled to let,because there are some plugins enabled to let,,,0
in an attempt to bring self monitoring to typo,task has been introduced to execute the syst,24009,24572,1
in our case we run view big installati,move add user icon in beusers backend module,,,0
thank you very much for the possibility of sor,sometimes it is very useful when sorting the,40365,40074,1
on validation errors extbase forwards to the,when validation error happens during form su,77025,70384,1
the way how you currently check for existence,the way how you currently check for existence,56556,56529,1
as developer for viewhelpers would like to,the tagbuilder should allow access to the attr,30555,37460,1
database structure should be optimized,the ts debugger in adminpanel fe has an opti,16914,15897,1
motivation \r\ncurrently there is being some,currently it not possible to search for loca,89582,89524,1
there is now use case for content negotiatio,the request object mainly webrequest should,10680,315,1
it could be nice useful having separate cs,since every content element should be consider,,,0
currently when using the standard pagetitle th,when using config pagetitlefirst the title se,31319,17030,0
