req1,req2,id1,id2,Label
currently quite some work is required in order,in order to cleanly separate between the domai,37402,35243,1
list or look up extensions field only looks,now that the whole db is local it could reall,16031,15640,0
because the flow framework follows rfc stand,with the recent change to not trigger persista,,,0
when you lost your session you could change,as part of implemented this idea \r\npa,15631,19152,1
the path to the php binary should be configura,distribution comes with an easy to use,6681,4426,1
have set rte default usecss = and firefox,using class or style attribute instead of,21509,18521,0
as the taskcenter also the sys action extensi,the taskcenter is redone completly to make it,22364,22363,1
different notifications on stages\r\n\r\nc,the workspace module uses the extbase dispatch,35245,35246,1
hi team \r\n\r\nno pagination available on htt,hi \r\n\r\nthe current system to browse record,,,0
introduced the new responsive images whe,it would be nice if it would be possible to re,,,0
apply default ordering based on the order in,alloweditems can currently only be modified th,,,0
problem currently expall lacks stdwrap proper,as the expall menu property is now going throu,,,0
was wondering why the new form content eleme,it would be great if the values setting for,45709,38163,0
afaik at the moment you need userfunc to,by using markers and properly quoting and esca,21169,22338,0
it should be possible to submit date through,now finally the property mapper needs to suppo,27417,5660,1
the attached patch allows to display different,fal allows files and folders to be restricted,6394,72529,1
it would be nice if placeholder could be ena,if you need compact formular one possible wa,67333,53406,1
the way how you currently check for existence,the way how you currently check for existence,,,0
the new plugin for selecting colors,the font tag is depreciated \r\n\r\ncann rte,19032,18457,1
d like new session implementation which\r\,today there no possibility to get flow worki,42403,42366,1
currently you can only place real images int,the multimedia ce is bit outdated and doesn,17854,20284,1
make the move element mask more user friendly,make the move element mask more user friendly,33693,33692,0
it would be great to have an option in the sch,hi \r\n\r\nthis might not be that valuable in,76015,52286,0
my suggestion for,website should be made to deliver the best,72049,71694,1
quite often editors request the possibility to,regarding this tweet,,,0
it should be possible to set protoc,currently the flow does not support multi doma,44891,53080,1
locale dependent messages texts will be stor,hi \r\n\r\n first sorry for my bad english,,,0
added support to clear cache only in subtrees,this text was response to / in,,,0
when rendering an image places it,would like to be able to tell the image,,,0
the rte can not supported in the tca \r\n\r\ne,it would be nice if textareas could be made re,16056,14941,0
when an editor sets maximum field length the,when an editor sets minimum field length the,,,0
hi \r\n\r\nplease add the serbian flag in the,not bug but very simple feature request wi,20709,18860,1
it would be nice having proof cookie authent,extend persistedusernamepasswordprovider wit,,,0
this is basically related to extbase and the,in case backend module does not rely on and,39729,39730,1
more hooks are always useful \r\ni miss one,would like to see hook added for checking,,,0
if you rename folder in the filelist and hav,prerequisits most likely,78036,90325,1
it would be nice to have the possibility to up,as stated by rené in the rte mailling list on,15110,15038,1
result of the workshop implementing reponsiv,allow to remove height and width information,,,0
sometimes validation should only be executed,as developer want to be able to validate,,,0
currently with fal there is no possibility to,hi \r\n\r\nit would be great if like in the,66514,46437,1
know that this is topic with long histor,with bugfix,69330,73139,0
similar to the automatic flushing of the refle,similar to the automatic flushing of the refle,,,0
one major source of errors when working with,it would be nice if one could define the names,,,0
think it would be nice if the icons in the,we need menu to call store and edit shortcu,18044,17868,1
currently settings which are typically define,as discussed on the last code sprint some sch,5068,31277,0
hello team \r\n\r\ndbal allows to map ta,hello team \r\n\r\noracle db has ch,56343,56258,1
hi \r\n\r\nthe current system to browse record,having folder with more than images th,64764,64401,1
if be user opens page with doctype sysfold,dear people and community \r\n\r\nthere is oft,36705,29790,1
since the backend comes with hardcoded,the backend should always have the typo,39947,37868,1
if the install tool could check whether the in,sometimes newly installed extensions break the,,,0
as complicated as it is easy to say hollow ou,in extbase have scenario where have to,69863,70036,1
to replace the various viewhelpers throughout,the core features two dedicated editrecordlink,85054,84983,1
offers possibility to open menu link,some users simple redactors don know what,,,0
flip it can used by tt content \r\nit should,current row should be part of cobj data \r\n\,44896,44858,1
update the caching framework to version,certain caches are static once they ve been fi,39430,32398,1
specifies new attribute called placeh,the extension tx form should allow using the,,,0
now fluidtemplate supports layoutrootpaths and,hi \r\n\r\nlets start to modernize content,66111,38732,1
curl allows \r\ncurlopt proxytype \teither cur,in some cases it may be necessary to have an,28258,28839,1
would like to be able to tell the image,when rendering an image places it,88954,59067,1
johannes feustel \r\n as an editor and as d,for website with users from the other side,,,0
videojs is included since as contr,core currently ships \r\n\r\nfor compati,37919,48223,1
hi \r\n\r\ni would like to make suggestion,the user information in the beuser module is,90478,90298,1
\r\nwhen you modify the ctype of content ele,when create new tt content entry using the,88908,76925,1
flip it can used by tt content \r\nit should,current row should be part of cobj data \r\n\,44896,44858,1
annoy user with warning so that she changes,currently there is no way to configure minim,14711,21659,0
to improve single sign on services backport,backport openid sysext developed at hackontest,19619,19409,1
hi \r\n\r\n first sorry for my bad english,cldr data contains information in xml format,6724,7722,1
the user cannot resize the popup or scroll the,if you use popupwindow in typo link,,,0
enhance functionality concerning passwor,admins should be able to define password pol,,,0
if makes it to core here is the patch,it would be nice if db provides an api,,,0
when scheduler task is marked as running th,this would be nice feature it would allow,63703,31073,1
my editors create lot of empty paragraphs li,only say parsefunc as not sure where thi,,,0
the following conditions have to be met \r\n\r,using class or style attribute instead of,18525,18521,1
flag for user that the password neeeds to,admins should be able to define password pol,,,0
hi \r\n\r\ni think it would be nice if the sor,it would be great to be able to sort the sched,54429,45535,1
in order to support new feature of templavoilà,the locate function isn supported in dbal \r,,,0
it would be nice if one could define the names,currently when using viewhelpers from part,58557,58829,1
website should be made to deliver the best,my suggestion for,,,0
should check somehow if mod rewrite is,add fallback for servers without mod rewrite /,1235,87,1
if use include typoscript source= file ext,pre include typoscript source= file filead,69789,16525,1
in fal image captions you can use links to pa,related is think about worth,,,0
think that should have debug toolbar,create toolbar that can be enabled to provid,26986,30890,1
suggestion for don know if som,based on the work from,67750,80477,1
launched discussion in the dev ml about in,following discussions on the dev mailing list,17771,17831,0
it would be nice to get the list of links grou,please ordered in ts the results for the url,,,0
the current accountfactory uses the generates,an implementation is already pending for,,,0
add an api method\r\n\r\n template addrecords,add an api method\r\n\r\n template addtcareco,19188,19190,1
first but important step towards the vision,came across video about tim berners lee on,24059,20862,1
when displaying search results slash is hard–,in indexed search/pi/class tx indexedsearch ph,,,0
adding data attributes to tag based viewhelper,all elements in can have any number of,49305,35748,0
if be user opens page with doctype sysfold,when the user select sysfolder in the page,36705,39051,1
actual use case is amazon aws where stuff lik,for sensitive data or other purposes it would,45851,26783,1
it would be very nice to be able to replace,with stdwrap it not possible yet to do orde,19320,19347,1
to be able to store byte unicode characters,there should be possibility to set the conne,80398,71454,1
it is not possible to use stdwrap with baseurl,the config baseurl setting should be processed,19244,18498,1
prepared queries would help take better advant,adodb supports memcache for queries,23374,21614,1
perhaps we should start with an example before,website should be made to deliver the best,17638,71694,1
when the slug changes for example because one,when updating an url segment from /parent pag,,,0
to retrieve one single object from repositor,the base repository should provide some magic,1677,2603,1
currently it is not possible to copy single,currently all actions to the clipboard are rou,31377,32152,1
as part of the self monitoring core need,in an attempt to bring self monitoring to typo,,,0
on many requests there should be viewhelper,based on the existing typolink view helper th,,,0
during entry of password data into password fi,provide strength meter for password fields,80791,80792,0
currently the installtool has this nice check,faced this problem lately when updated the,,,0
to move ui elements around in the be ui it is,the backend search from the shortcut frame nee,17678,17866,1
currently if viewhelper throws an exception,fluid parsing exceptions should contain the pa,,,0
serializing is not clean at all and can potent,it be useful to have way to automatically,83338,4387,1
in the old extension manager it was possible,the new documentation module provides signal,49090,50003,0
youtube video urls in the media element are re,currently cms has no easy/working way fo,,,0
quite often editors request the possibility to,regarding this tweet,,,0
think it is too much boiler plate to registe,registering plugins based on tt conent became,65265,48538,1
an implementation is already pending for,the current accountfactory uses the generates,28230,26786,1
currently there is no way to configure minim,flag for user that the password neeeds to,21659,59073,1
currently it not possible to search for loca,motivation \r\ncurrently there is being some,,,0
similiar to the page type selector it is hard,jens made nice screen where he grouped the,17694,17676,1
currently cms has no easy/working way fo,youtube video urls in the media element are re,61799,53421,1
there are lots of parameters in gifbuilder tha,currently the breakwidth property of gifbuilde,,,0
the default behaviour of the inline tca input,the current implementation always adds new irr,85986,24019,1
widget which shows the content going offline,widget which shows the content going offline,35348,36247,1
motivation \r\ncurrently there is being some,for multi language sites it is not really conv,89582,46017,1
to enhanced the security change install tool,when you log into the install tool the passwo,,,0
since the viewpage module shows sele,bring responsive adaption for viewpage preview,51865,51148,1
when using the select type instead of inlin,the default behaviour for inline records creat,17463,17268,1
sends out various emails it would be be,the current way to go when implementing mail,,,0
that would be great to have an install tool wi,we now have the update wizard in the install,,,0
currently you can define in frontend plugin th,the option custom field will be renamed to,30713,31960,0
to move ui elements around in the be ui it is,we need menu to call store and edit shortcu,17678,17868,1
add an api method\r\n\r\n template addtcareco,the current marker templating system collected,,,0
this is general inconsistency issue througho,in it was decided that the protocol sele,,,0
bring responsive adaption for viewpage preview,usability and of viewpage module should be imp,,,0
the nonrelationtables and nonrelationfields,the patch,79387,65461,1
when validation error happens during form su,on validation errors extbase forwards to the,,,0
currently all resources need database becau,currently you have to delete unused resources,,,0
observed with cms loc,observed with cms loc,88844,88845,1
the attached patch adds an optional paste as,in some of my smaller projects it would be cre,23797,23403,0
problem currently expall lacks stdwrap proper,as the expall menu property is now going throu,,,0
dealing with lots of images in be is quite pai,miss the possibility to delete multiple file,60835,52150,1
initial situation \r\ni have menu point in,add linkhandler functionality to page type sho,17406,66218,1
this could be considered as discussion and,currently the resolution of view class and,33487,42176,1
noticed that only pages and language tab,tried to use the new way to handle restric,84493,84244,1
this threat is associated to the ticket \r\n\r,hello \r\n\r\nsometimes it is necessary to use,,,0
videojs is included since as contr,currently ships with now requires,37919,37921,1
this is new feature request for replace,actually use with dam because of,67732,56133,0
the nonrelationtables and nonrelationfields,the patch,79387,65460,1
currently afaik the only option to set va,objects yaml should allow for adding and ove,,,0
the default behaviour for inline records creat,d like to have the possibility to store inli,17268,17125,0
using the clipboard to other than normal,in the list view you can easily select multipl,26139,65069,1
if you insert image in rte miss the option,feature request \r\n\r\nthe ability to add,20188,16918,0
by default all pages are configured with ur,problem \r\nwe want to use for some pa,46064,32343,0
implement proper http support \r\n\r\nthis,in order to cleanly separate between the domai,,,0
it would be great to be able to sort the sched,hi \r\n\r\ni think it would be nice if the sor,,,0
while editing records based on irre the curren,there exist cases when many child records are,,,0
currently page of type shortcut can only,this issue is already well known and already,46138,17037,1
show somehow which user passwords are treatend,admins should be able to define password pol,,,0
it would be great to have an option in the sch,hi \r\n\r\nthis might not be that valuable in,76015,52286,0
the object framework should support custom fac,currently it is not possible to pass construc,2110,2109,1
we have lot of customers who are migrating,it would be nice to have message field in th,88470,90243,1
tceforms has the so called multi record edit,currently multiple records are shown one after,,,0
there should be possibility to have at least,it would be great to be able to arrange flexfo,75266,92903,1
wrote viewhelper for fe edit it would be,add new frontend editing extension that adds,66620,79633,1
above the pagetree there are icons for inserti,this feature request is result from ge,29105,25183,1
while working with records listings in the lis,hello \r\n\r\ni dont know if this big has alre,,,0
the workspace selector is currently using lo,functionality which is not needed on system,,,0
this is better solution for bug it of,according to the documentation it is possible,,,0
lot of extensions need number formating nea,when handling prices or other special formated,17912,22279,0
having the following gives us functionality to,integrate the linkhandler into the core not,,,0
currently clearcachecmd can only clear all ca,currently there exists no direct way using typ,20305,45090,1
when using the propertymapper it is useful to,settings allowed properties on the configurati,,,0
scenario \r\nhaving installed themes gridel,please add possibility to deactivate an exte,73495,71525,0
problem \r\ncurrently you need to use another,problem \r\ncurrently you can use extdirect de,23565,23626,1
perhaps we should start with an example before,uses the gr list which indicates the,17638,17630,1
only say parsefunc as not sure where thi,my editors create lot of empty paragraphs li,20555,39676,1
provide strength meter for password fields,admins should be able to define password pol,80792,80793,0
when updating an url segment from /parent pag,when the slug changes for example because one,86496,86495,1
it should be possible to show openid provider,integrate possibility to enforce the usage,,,0
introduces several page tsconfig settings to,in the different modules there still are the,18879,23506,1
currently atagparams only takes string as,currently the atagparams of tmenuitem is jus,15166,14886,0
check if it is possible to upload multiple fil,allow the editor to set the multiple attribu,82356,80129,1
the base for the new layout \r\n,see,,,0
add flags for all languages supported by,patch attached it uses the same extension as,,,0
it would be great if two persons with differ,currently there is no way to controll concuren,,,0
the search result has path with the pagetree,the result of an indexed search search shows,,,0
introduced the new responsive images whe,would need to allow uploading more than one ve,57417,27391,1
have you ever consider to add \r\nexpand/colla,here is the diff that creates same functionali,,,0
the gifbuilder cobject does not have the abili,feature request support for alpha transparenc,28405,22455,0
currently fluid throws nice exception when,it should be possible to render certain except,40857,39423,1
currently the resolution of view class and,this could be considered as discussion and,,,0
to give users the possibility to format th,the login screen offers way to display,,,0
in some cases it would be good to have at leas,think that the option displaycond should,37939,18211,0
admins should be able to define password pol,enhance functionality concerning passwor,80793,87299,1
backport the change already merged to flow flu,all elements in can have any number of,61351,35748,1
add support to reference file wirh ext syntax,currently the svg content object renders svg,82108,82091,1
suggesting typoscript parameter for hmenu sp,starting from and expanding that idea,,,0
it is sometimes useful to be able to specify,sometimes it nice to put smaller image on,20041,14777,0
problem \r\ncurrently you need to use another,problem \r\ncurrently you can use extdirect de,23565,23626,1
it would be much easier to style the map when,it is difficult to eliminate unwanted br tag,,,0
flag for user that the password neeeds to,flag for user that the password neeeds to,,,0
it would be great if one could also change the,at the list module extended view the are lo,,,0
would allow using ucfirst/ucwords and similar,stdwrap should have function to make the fir,28045,28018,1
for website with users from the other side,johannes feustel \r\n as an editor and as d,64372,61110,1
would be cool if there was single media fiel,the be configuration module for damlightbox sh,6060,6398,1
since the block mode is gone\r\n,in the termplate analyzer in the blockmode,33670,25225,0
allow fluid arrays only in viewhelper argument,see mailinglist thread about limitations in,43356,7608,1
this change,all elements in can have any number of,61171,35748,1
since the comparing of be user records,hi \r\n\r\ni would like to make suggestion,90826,90478,1
when using date or time field timestamp as,have user table and membership history,17398,17234,0
by using mod web list allowedtables you can ad,ve got container element with grid colum,50360,71365,1
sometimes need locate page in page tree by,afaik such method does not exist \r\n\r\n\r,,,0
currently quite some work is required in order,in order to cleanly separate between the domai,37402,35243,1
the tagging features of the file backend are,update the caching framework to version,,,0
sometimes you wish to give control instruction,the debug function at src,23899,86220,1
faced this problem lately when updated the,currently the installtool has this nice check,71868,64513,1
add an option to blacklist ips for configura,our current brute force protection is non exis,21661,75987,1
usability feature \r\n\r\nproblem \r\nactual,when the user select sysfolder in the page,64406,39051,0
for multi language sites it is not really conv,motivation \r\ncurrently there is being some,,,0
page not found\r\n\r\nreason request paramete,page not found\r\n\r\nreason request paramete,61594,61663,1
currently it only possible to create compl,don see possibility to add existing reco,,,0
hi \r\n\r\nit would be great if like in the,it should be nice if you can use drag and drop,46437,63315,1
for custom applications the bundled validators,add the possibility to customize the validatio,28399,6456,1
as part of the self monitoring core need,in an attempt to bring self monitoring to typo,,,0
as workspaces got an own sysext some stuff is,in the last year the newly formed workspaces,24023,24022,1
it is possible to add different url for manu,this was an idea / feature request that was ma,,,0
the additionalparams behaviour should be als,with the rte htmlarea link popup doing an,,,0
sphinx builder may be specified language to,currently the documentation template and,50759,50757,0
hey guys \r\n\r\ni want to suggest new featu,currently it not possible to search for loca,,,0
currently there is no fixed time during the ap,expired cache entries even those of caches,1787,1785,0
often when you want to store different kinds,if be user opens page with doctype sysfold,51915,36705,1
it would be great to add check/warning for the,annoy user with warning so that she changes,14682,14711,1
all elements in can have any number of,backport the change already merged to flow flu,,,0
it would be nice to have message field in th,as user want to be able to add link or,90243,84849,1
core currently ships \r\n\r\nfor compati,currently ships with now requires,,,0
all elements in can have any number of,this change,,,0
since the comparing of be user records,hi \r\n\r\ni would like to make suggestion,90826,90478,1
is it possible to make backend panels resizabl,with cms version in the be the colum,84183,78760,1
it should be able to set one \datetime propert,it should be possible to submit date through,29564,27417,0
having framework that supports esi would giv,in order to cleanly separate between the domai,,,0
extension dd googlesitemap,when documentation gets bigger it could be,45637,45827,0
div geturl is know to be hudge and,override any of the curl options to forg,,,0
fal allows files and folders to be restricted,htaccess works for files only it would be bet,,,0
as complicated as it is easy to say hollow ou,the information around an error templating ta,69863,49903,1
the default behaviour for inline records creat,when using the select type instead of inlin,,,0
add wincache as an option for the cache backend,wincache is memory key value cache similar,,,0
it should be possible to extend postprocessor,this may be feature request for manual ext,38255,32701,0
iam talking about \r\n\r\n\r\nimages,currently with fal there is no possibility to,,,0
currently fluid throws nice exception when,it should be possible to render certain except,40857,39423,1
filter the workspaces changes that only the,like filtering based on language user pages,15459,16858,1
we repeatedly have errors in the log due to in,the linkvalidator default pagetsconfig curre,,,0
distribution comes with an easy to use,currently provides command line interf,,,0
sometimes you want to let certain scheduler,currently manually executed tasks are run dire,,,0
we just launched new website with about,this is huge performance killer when cache,,,0
what do you think of checking for write permis,if you unpack the dummy package in blank vho,,,0
with description field it would be possible,bring central definition and output the descri,59570,67550,0
problem\r\n\r\ncurrently rtehtmlparser,problem\r\n\r\ncurrently the links are di,,,0
it would be nice if could check wheth,the attached patch implements autoloading for,16385,19503,0
the backend should always have the typo,since the backend comes with hardcoded,,,0
currently it is not possible to pass construc,the object framework should support custom fac,,,0
hello dear docu team \r\nplease add documentat,noticed that there is no login error hook,33717,29698,1
have to test other file manipulation methods,streaming of downloads has the advantage that,5750,5785,1
since quite long time there is the requireme,it should be nice to add some record control,17801,17346,0
noticed that there is no login error hook,hello dear docu team \r\nplease add documentat,,,0
use case \r\nwe would like customize the csv,when create task sql query and make,85590,71321,1
to move ui elements around in the be ui it is,we need menu to clear caches all caches pa,17678,17867,1
when classes are extended inheritance should,currently it not possible to extend the \typ,,,0
this is my second task for equipping wit,d like to bring some crypto related code int,73164,73050,1
wrote viewhelper for fe edit it would be,add new frontend editing extension that adds,66620,79633,1
d like new session implementation which\r\,today there no possibility to get flow worki,42403,42366,1
configuring urls in is pain in the ass \,speaking urls must be core feature in,,,0
wie wäre es im install tool unter punkt dat,problem \r\ncurrently testing lot of pat,21392,20733,0
